protein_id	fasta_headers	gene_symbols_or_id	MS1d4-L	MS2d4-L	MW1d4-L	MW2d4-L
Q9D273	>sp|Q9D273|MMAB_MOUSE Corrinoid adenosyltransferase MMAB OS=Mus musculus OX=10090 GN=Mmab PE=1 SV=1	MMAB	20.668828496761	20.5614655199955	19.720115842525	20.6129913240114
P16332	>sp|P16332|MUTA_MOUSE Methylmalonyl-CoA mutase, mitochondrial OS=Mus musculus OX=10090 GN=Mmut PE=1 SV=2	MMUT	20.8485344157321	20.3610659564961	20.7553419083889	20.9376070326299
A0A087WQB0	>tr|A0A087WQB0|A0A087WQB0_MOUSE Isoform of P60762, Mortality factor 4 like 1 OS=Mus musculus OX=10090 GN=Morf4l1 PE=1 SV=1	MORF4L1		16.1233003490824	17.4722242477498	17.3945266703893
Q9R0Q4	>sp|Q9R0Q4|MO4L2_MOUSE Mortality factor 4-like protein 2 OS=Mus musculus OX=10090 GN=Morf4l2 PE=1 SV=1	MORF4L2	21.992356323662	21.5781225487259	21.9796219878006	21.8751877462559
P23249	>sp|P23249|MOV10_MOUSE Putative helicase MOV-10 OS=Mus musculus OX=10090 GN=Mov10 PE=1 SV=2	MOV10	19.094522993857	18.9067224058922	19.8594448257065	18.8630390039324
Q9D023	>sp|Q9D023|MPC2_MOUSE Mitochondrial pyruvate carrier 2 OS=Mus musculus OX=10090 GN=Mpc2 PE=1 SV=1	MPC2	18.2444447961796	18.9412851061736		18.6276208634255
Q810V0	>sp|Q810V0|MPP10_MOUSE U3 small nucleolar ribonucleoprotein protein MPP10 OS=Mus musculus OX=10090 GN=Mphosph10 PE=1 SV=2	MPHOSPH10		18.5407895582962		20.8860186962785
Q924M7	>sp|Q924M7|MPI_MOUSE Mannose-6-phosphate isomerase OS=Mus musculus OX=10090 GN=Mpi PE=1 SV=1	MPI	17.5352345592709	16.8695498963531	17.8191580851618	18.292130754879
P70290	>sp|P70290|EM55_MOUSE 55 kDa erythrocyte membrane protein OS=Mus musculus OX=10090 GN=Mpp1 PE=1 SV=1	MPP1	20.4050571572791	20.2349154997436	18.894470686572	19.7928406751612
P97434	>sp|P97434|MPRIP_MOUSE Myosin phosphatase Rho-interacting protein OS=Mus musculus OX=10090 GN=Mprip PE=1 SV=2	MPRIP	19.4820166798234	19.1337931578083	19.4883953126597	19.25291813132
Q99J99	>sp|Q99J99|THTM_MOUSE 3-mercaptopyruvate sulfurtransferase OS=Mus musculus OX=10090 GN=Mpst PE=1 SV=4	MPST	20.0091429438884	18.6995881259276	20.4307323363639	20.1927755036509
Q64449	>sp|Q64449|MRC2_MOUSE C-type mannose receptor 2 OS=Mus musculus OX=10090 GN=Mrc2 PE=1 SV=3	MRC2	18.0293461267832	18.446859270748	18.5018522894514	18.5851560817195
Q61216	>sp|Q61216|MRE11_MOUSE Double-strand break repair protein MRE11 OS=Mus musculus OX=10090 GN=Mre11 PE=1 SV=1	MRE11	18.4680919391665	18.0062415418983	18.4681854479877	19.1599222595555
Q9CQL7	>sp|Q9CQL7|MOFA1_MOUSE MORF4 family-associated protein 1 OS=Mus musculus OX=10090 GN=Mrfap1 PE=1 SV=1	MRFAP1	20.8677609697088	19.1653789615406	20.821318953209	20.1397778687365
Q99N96	>sp|Q99N96|RM01_MOUSE Large ribosomal subunit protein uL1m OS=Mus musculus OX=10090 GN=Mrpl1 PE=1 SV=2	MRPL1	18.3888454903309	17.9026810979516	18.1137005915525	
Q9CQF0	>sp|Q9CQF0|RM11_MOUSE Large ribosomal subunit protein uL11m OS=Mus musculus OX=10090 GN=Mrpl11 PE=1 SV=1	MRPL11	20.678353953338	20.0036467568704	21.0351373243164	20.6946743460653
Q9DB15	>sp|Q9DB15|RM12_MOUSE Large ribosomal subunit protein bL12m OS=Mus musculus OX=10090 GN=Mrpl12 PE=1 SV=2	MRPL12	20.8107236294368	19.8360320396651	21.2925647773087	21.0555508376925
Q9D1P0	>sp|Q9D1P0|RM13_MOUSE Large ribosomal subunit protein uL13m OS=Mus musculus OX=10090 GN=Mrpl13 PE=1 SV=1	MRPL13	19.7401645473226	19.7962600120498	19.5783629403809	20.2302515073908
Q9D1I6	>sp|Q9D1I6|RM14_MOUSE Large ribosomal subunit protein uL14m OS=Mus musculus OX=10090 GN=Mrpl14 PE=1 SV=1	MRPL14	19.4469475630539	18.9980793025357	18.6229383854741	19.0202548956577
Q9CPR5	>sp|Q9CPR5|RM15_MOUSE Large ribosomal subunit protein uL15m OS=Mus musculus OX=10090 GN=Mrpl15 PE=1 SV=1	MRPL15	19.7838106382916	19.5641878225135	19.4241343532154	19.4901023045228
Q9D8P4	>sp|Q9D8P4|RM17_MOUSE Large ribosomal subunit protein bL17m OS=Mus musculus OX=10090 GN=Mrpl17 PE=1 SV=1	MRPL17	20.1835219974288	19.4900823325739	20.0532973873719	20.4240927514735
Q9CQL5	>sp|Q9CQL5|RM18_MOUSE Large ribosomal subunit protein uL18m OS=Mus musculus OX=10090 GN=Mrpl18 PE=1 SV=1	MRPL18	18.0426626607386	18.5499781243069	18.3053133467595	
Q9D773	>sp|Q9D773|RM02_MOUSE Large ribosomal subunit protein uL2m OS=Mus musculus OX=10090 GN=Mrpl2 PE=1 SV=1	MRPL2	20.4999077542522	20.0196228179956	20.8279088683122	20.7320723801701
Q9D1N9	>sp|Q9D1N9|RM21_MOUSE Large ribosomal subunit protein bL21m OS=Mus musculus OX=10090 GN=Mrpl21 PE=1 SV=1	MRPL21	20.0708690909377	20.0836706951491	19.7110822674489	20.0203134669385
Q8BU88	>sp|Q8BU88|RM22_MOUSE Large ribosomal subunit protein uL22m OS=Mus musculus OX=10090 GN=Mrpl22 PE=1 SV=1	MRPL22		17.9227436326778	19.0905435505254	18.865761157291
O35972	>sp|O35972|RM23_MOUSE Large ribosomal subunit protein uL23m OS=Mus musculus OX=10090 GN=Mrpl23 PE=1 SV=1	MRPL23	18.3810473780556	18.2711193086619	18.1589794543325	18.2636167292399
Q9CQ06	>sp|Q9CQ06|RM24_MOUSE Large ribosomal subunit protein uL24m OS=Mus musculus OX=10090 GN=Mrpl24 PE=1 SV=1	MRPL24	19.8272021594419	19.3058017327265	19.7391966152954	20.067595781319
Q9D1B9	>sp|Q9D1B9|RM28_MOUSE Large ribosomal subunit protein bL28m OS=Mus musculus OX=10090 GN=Mrpl28 PE=1 SV=3	MRPL28	19.5792500015358	18.9733203819206	19.2844074624691	19.1937236712116
Q9CQP0	>sp|Q9CQP0|RM33_MOUSE Large ribosomal subunit protein bL33m OS=Mus musculus OX=10090 GN=Mrpl33 PE=1 SV=1	MRPL33	20.352140787747	20.7646460120763	20.4703376806576	20.6642731645715
Q99N91	>sp|Q99N91|RM34_MOUSE Large ribosomal subunit protein bL34m OS=Mus musculus OX=10090 GN=Mrpl34 PE=1 SV=1	MRPL34	21.1903523331785	19.2665858250927	21.4727020729424	21.2872402783752
Q9CQL6	>sp|Q9CQL6|RM35_MOUSE Large ribosomal subunit protein bL35m OS=Mus musculus OX=10090 GN=Mrpl35 PE=2 SV=1	MRPL35	18.164018297039	18.6573949757815	17.2861291926505	18.2684083752718
Q8K2M0	>sp|Q8K2M0|RM38_MOUSE Large ribosomal subunit protein mL38 OS=Mus musculus OX=10090 GN=Mrpl38 PE=1 SV=2	MRPL38	19.5878988755899	18.4107058071497	20.1468675528774	19.9485815178306
Q9JKF7	>sp|Q9JKF7|RM39_MOUSE Large ribosomal subunit protein mL39 OS=Mus musculus OX=10090 GN=Mrpl39 PE=1 SV=4	MRPL39		17.6232552501812	18.0164717969465	
Q9DCU6	>sp|Q9DCU6|RM04_MOUSE Large ribosomal subunit protein uL4m OS=Mus musculus OX=10090 GN=Mrpl4 PE=1 SV=1	MRPL4	18.1658993862458	18.5338818806131	18.5150511475116	17.8032238215666
Q9Z2Q5	>sp|Q9Z2Q5|RM40_MOUSE Large ribosomal subunit protein mL40 OS=Mus musculus OX=10090 GN=Mrpl40 PE=1 SV=2	MRPL40	20.0261164766688	18.5995432158759	20.4431508305439	19.9747178871129
Q9CQN7	>sp|Q9CQN7|RM41_MOUSE Large ribosomal subunit protein mL41 OS=Mus musculus OX=10090 GN=Mrpl41 PE=1 SV=1	MRPL41	20.0901803014929	18.6784244101091	20.6120465172034	20.091394774252
Q5RL20	>tr|Q5RL20|Q5RL20_MOUSE Isoform of Q99N89, Large ribosomal subunit protein mL43 OS=Mus musculus OX=10090 GN=Mrpl43 PE=1 SV=1	MRPL43	20.014331477914	19.2355710142173	20.1855956000754	20.2452307766651
Q9D0Q7	>sp|Q9D0Q7|RM45_MOUSE Large ribosomal subunit protein mL45 OS=Mus musculus OX=10090 GN=Mrpl45 PE=1 SV=1	MRPL45	17.6794094258205	17.5302511429784		17.5984958395014
Q9EQI8	>sp|Q9EQI8|RM46_MOUSE Large ribosomal subunit protein mL46 OS=Mus musculus OX=10090 GN=Mrpl46 PE=1 SV=1	MRPL46	18.125460411263	18.6712401463634	18.5347911148575	18.5291766002371
Q8K2Y7	>sp|Q8K2Y7|RM47_MOUSE Large ribosomal subunit protein uL29m OS=Mus musculus OX=10090 GN=Mrpl47 PE=1 SV=2	MRPL47	19.9479336090212	19.3135937183604	19.3423238980905	20.1001279426427
Q8VDT9	>sp|Q8VDT9|RM50_MOUSE Large ribosomal subunit protein mL50 OS=Mus musculus OX=10090 GN=Mrpl50 PE=1 SV=2	MRPL50	20.2313027346498	19.6992765476086	20.4763623085538	20.394115869832
Q9CPY1	>sp|Q9CPY1|RM51_MOUSE Large ribosomal subunit protein mL51 OS=Mus musculus OX=10090 GN=Mrpl51 PE=1 SV=1	MRPL51	20.6782336183972	20.975784176744	20.0792545757005	20.7469781258065
Q9D0Y8	>sp|Q9D0Y8|RM52_MOUSE Large ribosomal subunit protein mL52 OS=Mus musculus OX=10090 GN=Mrpl52 PE=1 SV=1	MRPL52	20.3184585451448	19.6889337821281	20.8921221222901	20.5828285344305
Q9D1H8	>sp|Q9D1H8|RM53_MOUSE Large ribosomal subunit protein mL53 OS=Mus musculus OX=10090 GN=Mrpl53 PE=1 SV=1	MRPL53	19.3066039216343	19.5850549875183	18.9680181024178	19.3898427364718
Q9CZ83	>sp|Q9CZ83|RM55_MOUSE Large ribosomal subunit protein mL55 OS=Mus musculus OX=10090 GN=Mrpl55 PE=1 SV=1	MRPL55	20.2794806972809	20.1382766909283	20.1047206667225	20.4216587268554
Q9CQF8	>sp|Q9CQF8|RT63_MOUSE Large ribosomal subunit protein mL63 OS=Mus musculus OX=10090 GN=Mrpl57 PE=1 SV=1	MRPL57	21.1140644225719	18.7278278609315	20.582346035902	21.0897434801135
Q8R035	>sp|Q8R035|ICT1_MOUSE Large ribosomal subunit protein mL62 OS=Mus musculus OX=10090 GN=Mrpl58 PE=1 SV=1	MRPL58	19.4406880490719	20.007859854698	19.2975990789652	19.8650668759549
Q99N94	>sp|Q99N94|RM09_MOUSE Large ribosomal subunit protein bL9m OS=Mus musculus OX=10090 GN=Mrpl9 PE=1 SV=2	MRPL9	20.6542673726327	18.8729388050907	21.2210163121195	20.8570870416936
Q9CR88	>sp|Q9CR88|RT14_MOUSE Small ribosomal subunit protein uS14m OS=Mus musculus OX=10090 GN=Mrps14 PE=1 SV=1	MRPS14	20.4133820080686	19.5210093262918	20.2421539700399	20.6128287997166
Q9DC71	>sp|Q9DC71|RT15_MOUSE Small ribosomal subunit protein uS15m OS=Mus musculus OX=10090 GN=Mrps15 PE=1 SV=2	MRPS15	19.0295152816416	20.6841528744441		19.4212369070645
Q9CPX7	>sp|Q9CPX7|RT16_MOUSE Small ribosomal subunit protein bS16m OS=Mus musculus OX=10090 GN=Mrps16 PE=1 SV=1	MRPS16	19.5974785316365	19.3853336173625	19.697525275793	19.6105330063795
Q99N84	>sp|Q99N84|RT18B_MOUSE Small ribosomal subunit protein mS40 OS=Mus musculus OX=10090 GN=Mrps18b PE=1 SV=1	MRPS18B	18.9545690945916	18.856903603354	19.252537659199	19.515786273399
Q924T2	>sp|Q924T2|RT02_MOUSE Small ribosomal subunit protein uS2m OS=Mus musculus OX=10090 GN=Mrps2 PE=1 SV=1	MRPS2	19.2114867606627	18.0633452941562	18.8936270154723	19.1435290363314
P58059	>sp|P58059|RT21_MOUSE Small ribosomal subunit protein bS21m OS=Mus musculus OX=10090 GN=Mrps21 PE=1 SV=1	MRPS21	19.9568638737135	18.9821481254887	19.2522982400935	19.910263265878
Q9CXW2	>sp|Q9CXW2|RT22_MOUSE Small ribosomal subunit protein mS22 OS=Mus musculus OX=10090 GN=Mrps22 PE=1 SV=1	MRPS22	18.7997988656689	19.0431682879752	18.5142022244066	19.1404659718778
Q8VE22	>sp|Q8VE22|RT23_MOUSE Small ribosomal subunit protein mS23 OS=Mus musculus OX=10090 GN=Mrps23 PE=1 SV=1	MRPS23	20.7291994593677	20.8749976527047	20.4442299400192	20.6970381300799
Q80ZS3	>sp|Q80ZS3|RT26_MOUSE Small ribosomal subunit protein mS26 OS=Mus musculus OX=10090 GN=Mrps26 PE=1 SV=1	MRPS26	18.3604989500769	19.1942934950626	18.7423717218876	19.0588006980976
Q9CY16	>sp|Q9CY16|RT28_MOUSE Small ribosomal subunit protein bS1m OS=Mus musculus OX=10090 GN=Mrps28 PE=1 SV=1	MRPS28	19.839777584415	19.6643979849639	20.7185438492626	19.9166095562576
Q61733	>sp|Q61733|RT31_MOUSE Small ribosomal subunit protein mS31 OS=Mus musculus OX=10090 GN=Mrps31 PE=1 SV=1	MRPS31	19.3329146289958	19.0343636917027	19.363845392619	19.4529420468508
Q9D2R8	>sp|Q9D2R8|RT33_MOUSE Small ribosomal subunit protein mS33 OS=Mus musculus OX=10090 GN=Mrps33 PE=1 SV=1	MRPS33	19.9051275527553	19.1313944823567	20.0248080060829	20.2529864389144
Q9JIK9	>sp|Q9JIK9|RT34_MOUSE Small ribosomal subunit protein mS34 OS=Mus musculus OX=10090 GN=Mrps34 PE=1 SV=1	MRPS34	19.4104303760962	19.0459478048072	19.6600612936635	19.560255339654
Q99N87	>sp|Q99N87|RT05_MOUSE Small ribosomal subunit protein uS5m OS=Mus musculus OX=10090 GN=Mrps5 PE=1 SV=1	MRPS5	19.0743798480057	19.3421136087631	19.886480873252	19.5642934361018
P58064	>sp|P58064|RT06_MOUSE Small ribosomal subunit protein bS6m OS=Mus musculus OX=10090 GN=Mrps6 PE=1 SV=3	MRPS6	20.3178988171681	20.2215545922602	20.4993610552622	20.6267972523084
Q80X85	>sp|Q80X85|RT07_MOUSE Small ribosomal subunit protein uS7m OS=Mus musculus OX=10090 GN=Mrps7 PE=1 SV=1	MRPS7	20.2233817233407	19.7724159723939	19.9702707970573	20.4364464444461
Q8K4J6	>sp|Q8K4J6|MRTFA_MOUSE Myocardin-related transcription factor A OS=Mus musculus OX=10090 GN=Mrtfa PE=1 SV=2	MRTFA	17.3858462240843	16.8031870880378	17.6413130020676	17.662178445301
G3X8R8	>tr|G3X8R8|G3X8R8_MOUSE Isoform of P59759, Megakaryoblastic leukemia 2 isoform 3 OS=Mus musculus OX=10090 GN=Mrtfb PE=1 SV=1	MRTFB	19.5569362493805	18.067813394407	20.2708987362986	19.0382691964259
P43247	>sp|P43247|MSH2_MOUSE DNA mismatch repair protein Msh2 OS=Mus musculus OX=10090 GN=Msh2 PE=1 SV=1	MSH2	19.9501633393685	19.7149830792176	20.244905347736	
Q920Q6	>sp|Q920Q6|MSI2H_MOUSE RNA-binding protein Musashi homolog 2 OS=Mus musculus OX=10090 GN=Msi2 PE=1 SV=1	MSI2	21.6835440520969	20.5223956949361	21.1487957076325	21.682450385866
P26041	>sp|P26041|MOES_MOUSE Moesin OS=Mus musculus OX=10090 GN=Msn PE=1 SV=3	MSN	20.6676675579269	20.9849685698729	20.6233587341886	20.651745037204
Q9D6Y7	>sp|Q9D6Y7|MSRA_MOUSE Mitochondrial peptide methionine sulfoxide reductase OS=Mus musculus OX=10090 GN=Msra PE=1 SV=1	MSRA	18.377122849793	18.7481886131493	18.3044161697815	18.5811417229224
Q78J03	>sp|Q78J03|MSRB2_MOUSE Methionine-R-sulfoxide reductase B2, mitochondrial OS=Mus musculus OX=10090 GN=Msrb2 PE=1 SV=1	MSRB2		17.1148939486091	17.8473145201682	
Q8BU85	>sp|Q8BU85|MSRB3_MOUSE Methionine-R-sulfoxide reductase B3, mitochondrial OS=Mus musculus OX=10090 GN=Msrb3 PE=1 SV=2	MSRB3	19.457890056362	19.2867533855985	19.8886161070164	19.2735926143778
F8WHY8	>tr|F8WHY8|F8WHY8_MOUSE Isoform of Q8K4B0, Metastasis associated 1 OS=Mus musculus OX=10090 GN=Mta1 PE=1 SV=1	MTA1	17.7841615920071	16.7781543697981	17.4636817640164	17.4471757379968
Q9R190	>sp|Q9R190|MTA2_MOUSE Metastasis-associated protein MTA2 OS=Mus musculus OX=10090 GN=Mta2 PE=1 SV=1	MTA2	19.0994497277599	18.5271512017178	18.9303163588549	19.1221220749437
Q9CQ65	>sp|Q9CQ65|MTAP_MOUSE S-methyl-5'-thioadenosine phosphorylase OS=Mus musculus OX=10090 GN=Mtap PE=1 SV=1	MTAP	18.6810784773605	20.1022941311646	18.7639618730539	19.3882365285383
Q922Q1	>sp|Q922Q1|MARC2_MOUSE Mitochondrial amidoxime reducing component 2 OS=Mus musculus OX=10090 GN=Mtarc2 PE=1 SV=1	MTARC2	19.0762846601503	18.4247940748772	19.1903320260523	18.8266241122721
P03930	>sp|P03930|ATP8_MOUSE ATP synthase protein 8 OS=Mus musculus OX=10090 GN=Mtatp8 PE=1 SV=1	MTATP8	21.8401413124684	21.5744756523531	22.0400915712757	22.1624348885793
Q791T5	>sp|Q791T5|MTCH1_MOUSE Mitochondrial carrier homolog 1 OS=Mus musculus OX=10090 GN=Mtch1 PE=1 SV=1	MTCH1	18.6472532587632	18.3492128149533	19.1624918535837	18.3166466185946
Q791V5	>sp|Q791V5|MTCH2_MOUSE Mitochondrial carrier homolog 2 OS=Mus musculus OX=10090 GN=Mtch2 PE=1 SV=1	MTCH2	19.2031089670726	19.8045700109993	18.6708549274622	19.157046079537
E1U8D0	>sp|E1U8D0|MTCL2_MOUSE Microtubule cross-linking factor 2 OS=Mus musculus OX=10090 GN=Mtcl2 PE=1 SV=4	MTCL2	19.4210801536574	18.0296379287113	19.3913293329593	19.0117538656446
P00405	>sp|P00405|COX2_MOUSE Cytochrome c oxidase subunit 2 OS=Mus musculus OX=10090 GN=Mtco2 PE=1 SV=1	MTCO2	17.9386225337723	19.6604632091029	18.8306487829066	18.9051591020944
F6ZSG0	>tr|F6ZSG0|F6ZSG0_MOUSE Isoform of Q80WJ7, Metadherin (Fragment) OS=Mus musculus OX=10090 GN=Mtdh PE=1 SV=1	MTDH	22.4626876147353	21.5297511306603		22.749122285423
Q80WJ7	>sp|Q80WJ7|LYRIC_MOUSE Protein LYRIC OS=Mus musculus OX=10090 GN=Mtdh PE=1 SV=1	MTDH	19.1186296736271	19.2531369048813	19.359418981128	19.2626838168237
Q9CWE0	>sp|Q9CWE0|MFR1L_MOUSE Mitochondrial fission regulator 1-like OS=Mus musculus OX=10090 GN=Mtfr1l PE=1 SV=1	MTFR1L	19.9133461369791	19.641293458392	20.1647934776766	19.8228025758848
Q922D8	>sp|Q922D8|C1TC_MOUSE C-1-tetrahydrofolate synthase, cytoplasmic OS=Mus musculus OX=10090 GN=Mthfd1 PE=1 SV=4	MTHFD1	19.1230321145678	19.6471120256959	18.8723615131758	19.2644192412339
Q3V3R1	>sp|Q3V3R1|C1TM_MOUSE Monofunctional C1-tetrahydrofolate synthase, mitochondrial OS=Mus musculus OX=10090 GN=Mthfd1l PE=1 SV=2	MTHFD1L	20.2837732886483	19.4604341511164	20.9584363537778	20.2108407480624
P18155	>sp|P18155|MTDC_MOUSE Bifunctional methylenetetrahydrofolate dehydrogenase/cyclohydrolase, mitochondrial OS=Mus musculus OX=10090 GN=Mthfd2 PE=1 SV=1	MTHFD2	19.3162024578032	18.4722840504728	19.542099623434	19.3317549285861
Q3URQ7	>sp|Q3URQ7|MTHSD_MOUSE Methenyltetrahydrofolate synthase domain-containing protein OS=Mus musculus OX=10090 GN=Mthfsd PE=2 SV=1	MTHFSD	18.1733550478216	17.6959043044986		17.7293757999411
Q91YJ5	>sp|Q91YJ5|IF2M_MOUSE Translation initiation factor IF-2, mitochondrial OS=Mus musculus OX=10090 GN=Mtif2 PE=1 SV=2	MTIF2	17.8090797792784	17.8767478758331	18.2561840648637	18.3249007088464
Q8VEL2	>sp|Q8VEL2|MTMRE_MOUSE Phosphatidylinositol-3,5-bisphosphate 3-phosphatase MTMR14 OS=Mus musculus OX=10090 GN=Mtmr14 PE=1 SV=2	MTMR14	19.4316869985885	17.613645777655	19.6244591430316	19.6388759355431
Q8VE11	>sp|Q8VE11|MTMR6_MOUSE Phosphatidylinositol-3,5-bisphosphate 3-phosphatase MTMR6 OS=Mus musculus OX=10090 GN=Mtmr6 PE=1 SV=1	MTMR6	18.1416090177038	18.629031226084	17.643712684303	18.3335434213597
Q9Z2D0	>sp|Q9Z2D0|MTMR9_MOUSE Myotubularin-related protein 9 OS=Mus musculus OX=10090 GN=Mtmr9 PE=1 SV=2	MTMR9	18.9678198136278	18.8242441926421	19.7101587079348	19.4753461157506
P03911	>sp|P03911|NU4M_MOUSE NADH-ubiquinone oxidoreductase chain 4 OS=Mus musculus OX=10090 GN=Mtnd4 PE=1 SV=1	MTND4		16.0488188493044	17.6697177916139	
P62774	>sp|P62774|MTPN_MOUSE Myotrophin OS=Mus musculus OX=10090 GN=Mtpn PE=1 SV=2	MTPN		18.059140222671	18.3241103143434	18.7868123975461
Q8C1A3	>sp|Q8C1A3|MTRR_MOUSE Methionine synthase reductase OS=Mus musculus OX=10090 GN=Mtrr PE=1 SV=2	MTRR	18.799726374979	17.7750179244675	18.8941928572046	19.0589254588749
Q8R1S4	>sp|Q8R1S4|MTSS1_MOUSE Protein MTSS 1 OS=Mus musculus OX=10090 GN=Mtss1 PE=1 SV=1	MTSS1	19.4921557911061	19.1402579858869	19.6630210894858	19.3697127468642
Q6P9S0	>sp|Q6P9S0|MTSS2_MOUSE Protein MTSS 2 OS=Mus musculus OX=10090 GN=Mtss2 PE=1 SV=1	MTSS2	18.3294135313309	18.7798439208103	18.3366063756202	17.8406027038058
O88441	>sp|O88441|MTX2_MOUSE Metaxin-2 OS=Mus musculus OX=10090 GN=Mtx2 PE=1 SV=1	MTX2		21.8000949097388	21.0699536233818	
Q8VCM5	>sp|Q8VCM5|MUL1_MOUSE Mitochondrial ubiquitin ligase activator of NFKB 1 OS=Mus musculus OX=10090 GN=Mul1 PE=1 SV=2	MUL1	17.3711050121441	17.5363301147254		17.8620937057914
Q99JI1	>sp|Q99JI1|MSTN1_MOUSE Musculoskeletal embryonic nuclear protein 1 OS=Mus musculus OX=10090 GN=Mustn1 PE=1 SV=1	MUSTN1	20.5711413326887	19.7752226157525	20.7757295124896	20.6328295896938
Q78HU3	>sp|Q78HU3|MB12A_MOUSE Multivesicular body subunit 12A OS=Mus musculus OX=10090 GN=Mvb12a PE=1 SV=1	MVB12A	18.3603939425358	18.7387869642567		19.153547529813
Q9R008	>sp|Q9R008|KIME_MOUSE Mevalonate kinase OS=Mus musculus OX=10090 GN=Mvk PE=1 SV=1	MVK		18.4993750622683	18.6182058963052	
Q9EQK5	>sp|Q9EQK5|MVP_MOUSE Major vault protein OS=Mus musculus OX=10090 GN=Mvp PE=1 SV=4	MVP	18.8695975012213	19.9830444582784	19.2272950137781	19.3326460824773
Q9DBV4	>sp|Q9DBV4|MXRA8_MOUSE Matrix remodeling-associated protein 8 OS=Mus musculus OX=10090 GN=Mxra8 PE=1 SV=1	MXRA8		18.198461793426		17.3596229435593
O35682	>sp|O35682|MYADM_MOUSE Myeloid-associated differentiation marker OS=Mus musculus OX=10090 GN=Myadm PE=1 SV=2	MYADM	18.7799723942853	17.7410641148013	18.4390995169342	17.7546079753695
Q7TPV4	>sp|Q7TPV4|MBB1A_MOUSE Myb-binding protein 1A OS=Mus musculus OX=10090 GN=Mybbp1a PE=1 SV=2	MYBBP1A	19.9315953913266	19.7479428310702	19.7327660995833	19.555846987823
Q6P6L5;A0A571BEN1;D3YU50	>tr|Q6P6L5|Q6P6L5_MOUSE Isoform of A0A571BEN1, Myosin binding protein C, slow-type OS=Mus musculus OX=10090 GN=Mybpc1 PE=1 SV=1;>tr|A0A571BEN1|A0A571BEN1_MOUSE Myosin binding protein C, slow-type OS=Mus musculus OX=10090 GN=Mybpc1 PE=1 SV=1;>tr|D3YU50|D3YU50_MOUSE Isoform of A0A571BEN1, Myosin binding protein C, slow-type OS=Mus musculus OX=10090 GN=Mybpc1 PE=1 SV=1	MYBPC1	18.2215859820251	18.9862935534959	18.770240251969	18.9351618794881
P70402	>sp|P70402|MYBPH_MOUSE Myosin-binding protein H OS=Mus musculus OX=10090 GN=Mybph PE=2 SV=2	MYBPH	20.2005723235466	20.7341353367787	19.898606289572	20.6943635843308
Q9EQS3	>sp|Q9EQS3|MYCBP_MOUSE c-Myc-binding protein OS=Mus musculus OX=10090 GN=Mycbp PE=1 SV=5	MYCBP	21.0879494434103	20.6830594782627	21.2604199072379	21.3745249601141
P22366	>sp|P22366|MYD88_MOUSE Myeloid differentiation primary response protein MyD88 OS=Mus musculus OX=10090 GN=Myd88 PE=1 SV=3	MYD88	15.4341652949556	15.4552154648196		15.3210966866867
Q9CPT4	>sp|Q9CPT4|MYDGF_MOUSE Myeloid-derived growth factor OS=Mus musculus OX=10090 GN=Mydgf PE=1 SV=1	MYDGF	19.0160188906121	16.8542819175023	19.5138950289236	19.3562795808116
Q8C854	>sp|Q8C854|MYEF2_MOUSE Myelin expression factor 2 OS=Mus musculus OX=10090 GN=Myef2 PE=1 SV=1	MYEF2	21.1601590457575	20.7819433876228	20.933427788536	21.1654739414282
Q9JK81	>sp|Q9JK81|MYG1_MOUSE MYG1 exonuclease OS=Mus musculus OX=10090 GN=Myg1 PE=1 SV=1	MYG1	20.2810163577315	19.9754498561454	20.2719587949455	20.4368055020608
Q5SX40	>sp|Q5SX40|MYH1_MOUSE Myosin-1 OS=Mus musculus OX=10090 GN=Myh1 PE=1 SV=1	MYH1	19.744708717097	20.4945098149792	19.6053950293922	20.1077527246431
Q5SV64	>tr|Q5SV64|Q5SV64_MOUSE Isoform of Q61879, Myosin, heavy polypeptide 10, non-muscle OS=Mus musculus OX=10090 GN=Myh10 PE=1 SV=1	MYH10	20.1967987101359	20.5699753639853	19.6587379451932	19.6605287787535
A0A2R8VHF9;A0A338P6K2;E9QPE7	>tr|A0A2R8VHF9|A0A2R8VHF9_MOUSE Isoform of O08638, Myosin-11 OS=Mus musculus OX=10090 GN=Myh11 PE=1 SV=1;>tr|A0A338P6K2|A0A338P6K2_MOUSE Isoform of O08638, Myosin-11 OS=Mus musculus OX=10090 GN=Myh11 PE=1 SV=1;>tr|E9QPE7|E9QPE7_MOUSE Isoform of O08638, Myosin-11 OS=Mus musculus OX=10090 GN=Myh11 PE=1 SV=2	MYH11	17.892387667824	18.9390293734188	17.8555465142064	
G3UW82	>sp|G3UW82|MYH2_MOUSE Myosin-2 OS=Mus musculus OX=10090 GN=Myh2 PE=1 SV=1	MYH2	19.6348379719295	21.3463688309175	20.061795304705	
P13541	>sp|P13541|MYH3_MOUSE Myosin-3 OS=Mus musculus OX=10090 GN=Myh3 PE=2 SV=2	MYH3	20.9093787282475	21.5164702474582	20.5636054680111	20.7597443366354
Q5SX39	>sp|Q5SX39|MYH4_MOUSE Myosin-4 OS=Mus musculus OX=10090 GN=Myh4 PE=1 SV=1	MYH4	19.5911890744466	19.2566860779205	19.0739879390003	19.7232497989782
A2AQP0	>sp|A2AQP0|MYH7B_MOUSE Myosin-7B OS=Mus musculus OX=10090 GN=Myh7b PE=3 SV=1	MYH7B	19.1733744134138	20.2227856443182	19.5768838654422	19.8502920278028
P13542	>sp|P13542|MYH8_MOUSE Myosin-8 OS=Mus musculus OX=10090 GN=Myh8 PE=2 SV=2	MYH8	20.7762299694977	21.1889295400412	20.4410655013755	20.8487551531108
Q8VDD5	>sp|Q8VDD5|MYH9_MOUSE Myosin-9 OS=Mus musculus OX=10090 GN=Myh9 PE=1 SV=4	MYH9	20.2059555817058	20.5372646351101	19.950987032895	19.9269320316614
P05977	>sp|P05977|MYL1_MOUSE Myosin light chain 1/3, skeletal muscle isoform OS=Mus musculus OX=10090 GN=Myl1 PE=1 SV=2	MYL1	21.0810031185753	21.8725716788115	21.2653480544149	21.5561648818156
P97457	>sp|P97457|MYL11_MOUSE Myosin regulatory light chain 11 OS=Mus musculus OX=10090 GN=Myl11 PE=1 SV=3	MYL11	20.4621421504844	21.1670831792393	20.996136540446	20.9155944582127
Q3THE2	>sp|Q3THE2|ML12B_MOUSE Myosin regulatory light chain 12B OS=Mus musculus OX=10090 GN=Myl12b PE=1 SV=2	MYL12B	24.3828350254698	23.4823434925889	23.988702846972	23.6206908486102
P09541	>sp|P09541|MYL4_MOUSE Myosin light chain 4 OS=Mus musculus OX=10090 GN=Myl4 PE=1 SV=3	MYL4	21.5501649204827	22.2650495855866	21.4417138367551	21.5521990635366
Q60605	>sp|Q60605|MYL6_MOUSE Myosin light polypeptide 6 OS=Mus musculus OX=10090 GN=Myl6 PE=1 SV=3	MYL6	19.9198942068426	21.5576723408912	19.8171156652306	20.0928434815715
Q8CI43	>sp|Q8CI43|MYL6B_MOUSE Myosin light chain 6B OS=Mus musculus OX=10090 GN=Myl6b PE=1 SV=1	MYL6B	20.6768086246925	20.8773001583547	20.8025100364181	20.5683715647432
Q9CQ19	>sp|Q9CQ19|MYL9_MOUSE Myosin regulatory light polypeptide 9 OS=Mus musculus OX=10090 GN=Myl9 PE=1 SV=3	MYL9	20.9521035821857	20.6831616166236	20.910624621158	20.578670995822
Q6PDN3	>sp|Q6PDN3|MYLK_MOUSE Myosin light chain kinase, smooth muscle OS=Mus musculus OX=10090 GN=Mylk PE=1 SV=3	MYLK	18.0953435046962	19.3363032390173	18.2281290876618	18.607606451266
F6ULR7	>tr|F6ULR7|F6ULR7_MOUSE Isoform of P97457, Fast skeletal myosin light chain 2 (Fragment) OS=Mus musculus OX=10090 GN=Mylpf PE=1 SV=8	MYLPF	20.8714195923639	20.9000297380767	21.4307611155688	21.2034453278494
E9PUR2	>tr|E9PUR2|E9PUR2_MOUSE Isoform of Q9JMH9, Myosin XVIIIA (Fragment) OS=Mus musculus OX=10090 GN=Myo18a PE=1 SV=2	MYO18A	20.7712016678769	20.5464522005572	20.9761521995414	20.928934466987
F6ZGN3	>tr|F6ZGN3|F6ZGN3_MOUSE Isoform of Q9JMH9, Myosin XVIIIA (Fragment) OS=Mus musculus OX=10090 GN=Myo18a PE=1 SV=2	MYO18A	19.7078345129681	19.4602836785059	19.4680515367915	19.357834962152
Q9JMH9	>sp|Q9JMH9|MY18A_MOUSE Unconventional myosin-XVIIIa OS=Mus musculus OX=10090 GN=Myo18a PE=1 SV=2	MYO18A	18.4596209583334	19.0132781208902	17.7551574402162	18.795593175369
E9PV66	>tr|E9PV66|E9PV66_MOUSE Myosin XVIIIb OS=Mus musculus OX=10090 GN=Myo18b PE=1 SV=1	MYO18B	20.9053668880828	20.1472628257817	20.0146285965641	21.0580444837155
P46735	>sp|P46735|MYO1B_MOUSE Unconventional myosin-Ib OS=Mus musculus OX=10090 GN=Myo1b PE=1 SV=3	MYO1B	19.2449003216084	17.2633334076823	19.486435395705	18.484572338764
Q9WTI7	>sp|Q9WTI7|MYO1C_MOUSE Unconventional myosin-Ic OS=Mus musculus OX=10090 GN=Myo1c PE=1 SV=2	MYO1C	19.6680678730203	19.3903202193685	19.5063219525586	19.6741132222172
Q5SYD0	>sp|Q5SYD0|MYO1D_MOUSE Unconventional myosin-Id OS=Mus musculus OX=10090 GN=Myo1d PE=1 SV=1	MYO1D	19.9519093908607	18.2128573589019	20.8063370407387	20.0225455256197
E9Q634	>sp|E9Q634|MYO1E_MOUSE Unconventional myosin-Ie OS=Mus musculus OX=10090 GN=Myo1e PE=1 SV=1	MYO1E	21.8238654163452	20.3793612669257	22.0418649285518	21.7964577354476
Q64331	>sp|Q64331|MYO6_MOUSE Unconventional myosin-VI OS=Mus musculus OX=10090 GN=Myo6 PE=1 SV=2	MYO6	19.6247110515279	18.3409778424976	19.8451012464946	19.7139028500147
Q8C170	>sp|Q8C170|MYO9A_MOUSE Unconventional myosin-IXa OS=Mus musculus OX=10090 GN=Myo9a PE=1 SV=2	MYO9A	19.510203628194	19.113998652275	19.5582138360639	19.0684171055479
