protein_id	fasta_headers	gene_symbols_or_id	MS1d4-L	MS2d4-L	MW1d4-L	MW2d4-L
P62843	>sp|P62843|RS15_MOUSE Small ribosomal subunit protein uS19 OS=Mus musculus OX=10090 GN=Rps15 PE=1 SV=2	RPS15	19.082687244161	19.4230488449337	18.6119963835102	18.9930202673257
P62245	>sp|P62245|RS15A_MOUSE Small ribosomal subunit protein uS8 OS=Mus musculus OX=10090 GN=Rps15a PE=1 SV=2	RPS15A	21.2118281890583	20.1296663006791	21.4316605531419	21.2350380301577
P14131	>sp|P14131|RS16_MOUSE Small ribosomal subunit protein uS9 OS=Mus musculus OX=10090 GN=Rps16 PE=1 SV=4	RPS16	22.0432227566984	22.3246393499614	21.9263635372243	21.9103756345556
P63276	>sp|P63276|RS17_MOUSE Small ribosomal subunit protein eS17 OS=Mus musculus OX=10090 GN=Rps17 PE=1 SV=2	RPS17	22.542795628457	21.78918856471	22.3211005198221	22.2947753078604
P62270	>sp|P62270|RS18_MOUSE Small ribosomal subunit protein uS13 OS=Mus musculus OX=10090 GN=Rps18 PE=1 SV=3	RPS18	22.0976081886215	22.2853690154534	21.9885577044055	22.0837780424915
Q9CZX8	>sp|Q9CZX8|RS19_MOUSE Small ribosomal subunit protein eS19 OS=Mus musculus OX=10090 GN=Rps19 PE=1 SV=3	RPS19	22.9951773904208	22.5993035060829	22.9337077640303	22.9380897180409
Q8C6B9	>sp|Q8C6B9|AROS_MOUSE Active regulator of SIRT1 OS=Mus musculus OX=10090 GN=Rps19bp1 PE=1 SV=1	RPS19BP1	19.6974263778277	18.3329547991851	19.6171945608194	19.2560082428806
P25444	>sp|P25444|RS2_MOUSE Small ribosomal subunit protein uS5 OS=Mus musculus OX=10090 GN=Rps2 PE=1 SV=3	RPS2	21.4458733993599	21.5588345993075	21.5392679194219	21.5545957912371
P60867	>sp|P60867|RS20_MOUSE Small ribosomal subunit protein uS10 OS=Mus musculus OX=10090 GN=Rps20 PE=1 SV=1	RPS20	21.8479573224611	22.1051952330237	21.588200213975	21.7476422227606
Q9CQR2	>sp|Q9CQR2|RS21_MOUSE Small ribosomal subunit protein eS21 OS=Mus musculus OX=10090 GN=Rps21 PE=1 SV=1	RPS21	23.7430148375824	22.696987512165	23.7621344367852	23.6860888026428
P62267	>sp|P62267|RS23_MOUSE Small ribosomal subunit protein uS12 OS=Mus musculus OX=10090 GN=Rps23 PE=1 SV=3	RPS23	20.5949220637836	21.2577018376677	20.411230339482	20.5568423676322
P62849	>sp|P62849|RS24_MOUSE Small ribosomal subunit protein eS24 OS=Mus musculus OX=10090 GN=Rps24 PE=1 SV=1	RPS24	21.2044632750328	20.8987745465844	21.0071750436497	21.1015407532626
P62852	>sp|P62852|RS25_MOUSE Small ribosomal subunit protein eS25 OS=Mus musculus OX=10090 GN=Rps25 PE=1 SV=1	RPS25	22.1640739970671	22.2413756278377	22.2411056086765	22.1594292723981
P62855	>sp|P62855|RS26_MOUSE Small ribosomal subunit protein eS26 OS=Mus musculus OX=10090 GN=Rps26 PE=1 SV=3	RPS26	20.3347202826089	20.9444103857502	20.7518908841942	20.4881446965191
Q6ZWU9	>sp|Q6ZWU9|RS27_MOUSE Small ribosomal subunit protein eS27 OS=Mus musculus OX=10090 GN=Rps27 PE=1 SV=3	RPS27	20.4162694489876	21.1700546501342	20.3989324409182	20.250017676571
P62983	>sp|P62983|RS27A_MOUSE Ubiquitin-ribosomal protein eS31 fusion protein OS=Mus musculus OX=10090 GN=Rps27a PE=1 SV=2	RPS27A	21.9486280454775	22.428824393355	22.5254323913822	22.415330499881
Q6ZWY3	>sp|Q6ZWY3|RS27L_MOUSE Small ribosomal subunit protein eS27-like OS=Mus musculus OX=10090 GN=Rps27l PE=1 SV=3	RPS27L	21.1229442539568	18.0560781162015	21.7365119539939	20.5504140460487
P62858	>sp|P62858|RS28_MOUSE Small ribosomal subunit protein eS28 OS=Mus musculus OX=10090 GN=Rps28 PE=1 SV=1	RPS28	21.3391557854235	21.1676704663241	21.2529740318853	21.3331774070312
P62274	>sp|P62274|RS29_MOUSE Small ribosomal subunit protein uS14 OS=Mus musculus OX=10090 GN=Rps29 PE=1 SV=2	RPS29	22.4835286019702	22.8001333686675	22.7389247801467	22.9211323163888
P62908	>sp|P62908|RS3_MOUSE Small ribosomal subunit protein uS3 OS=Mus musculus OX=10090 GN=Rps3 PE=1 SV=1	RPS3	19.6860569872603	19.8230577400857	19.8144702069462	19.6508584073637
P97351	>sp|P97351|RS3A_MOUSE Small ribosomal subunit protein eS1 OS=Mus musculus OX=10090 GN=Rps3a PE=1 SV=3	RPS3A	21.0018760913146	21.743282176692	20.9742736477886	21.2536057072537
P62702	>sp|P62702|RS4X_MOUSE Small ribosomal subunit protein eS4 OS=Mus musculus OX=10090 GN=Rps4x PE=1 SV=2	RPS4X	20.8271136417451	21.4434771725108	20.6265492184194	20.8999833517478
P97461	>sp|P97461|RS5_MOUSE Small ribosomal subunit protein uS7 OS=Mus musculus OX=10090 GN=Rps5 PE=1 SV=4	RPS5	20.7691949185642	21.3025505246835	20.8595737696431	20.9991486346876
P62754	>sp|P62754|RS6_MOUSE Small ribosomal subunit protein eS6 OS=Mus musculus OX=10090 GN=Rps6 PE=1 SV=1	RPS6	21.6222924775261	21.2848438124958	21.7751776853308	21.5385662314288
P18654	>sp|P18654|KS6A3_MOUSE Ribosomal protein S6 kinase alpha-3 OS=Mus musculus OX=10090 GN=Rps6ka3 PE=1 SV=2	RPS6KA3	18.4895444434114	18.863602454871	18.8555399974671	18.0862995571744
P62082	>sp|P62082|RS7_MOUSE Small ribosomal subunit protein eS7 OS=Mus musculus OX=10090 GN=Rps7 PE=1 SV=1	RPS7	20.8503377030878	21.0020261556613	20.8723225971663	20.9408835702708
P62242	>sp|P62242|RS8_MOUSE Small ribosomal subunit protein eS8 OS=Mus musculus OX=10090 GN=Rps8 PE=1 SV=2	RPS8	22.2528235722674	22.5817783737887	22.0758778118797	22.0398629657756
Q6ZWN5	>sp|Q6ZWN5|RS9_MOUSE Small ribosomal subunit protein uS4 OS=Mus musculus OX=10090 GN=Rps9 PE=1 SV=3	RPS9	20.6669808747196	20.9845258952335	20.5666296626361	20.6544694557132
P14206	>sp|P14206|RSSA_MOUSE Small ribosomal subunit protein uS2 OS=Mus musculus OX=10090 GN=Rpsa PE=1 SV=4	RPSA	20.9304289427091	21.1904161545071	20.7279544691082	20.6022129717905
Q9CWX4	>sp|Q9CWX4|RUSD4_MOUSE Pseudouridylate synthase RPUSD4, mitochondrial OS=Mus musculus OX=10090 GN=Rpusd4 PE=2 SV=1	RPUSD4	18.2484684512123	17.7903903774549		18.5613917488205
O88667	>sp|O88667|RAD_MOUSE GTP-binding protein RAD OS=Mus musculus OX=10090 GN=Rrad PE=1 SV=1	RRAD	19.4890746127706	19.4363411862061	19.9812889463597	20.6123900003191
Q6NTA4;Q80X95	>sp|Q6NTA4|RRAGB_MOUSE Ras-related GTP-binding protein B OS=Mus musculus OX=10090 GN=Rragb PE=1 SV=1;>sp|Q80X95|RRAGA_MOUSE Ras-related GTP-binding protein A OS=Mus musculus OX=10090 GN=Rraga PE=1 SV=1	RRAGB;RRAGA	19.0359959296723	18.5849131838231		19.1439687090478
Q7TT45;Q99K70	>sp|Q7TT45|RRAGD_MOUSE Ras-related GTP-binding protein D OS=Mus musculus OX=10090 GN=Rragd PE=1 SV=2;>sp|Q99K70|RRAGC_MOUSE Ras-related GTP-binding protein C OS=Mus musculus OX=10090 GN=Rragc PE=1 SV=1	RRAGD;RRAGC		19.8540203165756		20.9330963488755
Q99PL5	>sp|Q99PL5|RRBP1_MOUSE Ribosome-binding protein 1 OS=Mus musculus OX=10090 GN=Rrbp1 PE=1 SV=2	RRBP1	20.3372756869097	20.3756033935844	20.4825638716222	20.0214351258439
Q3UH06	>sp|Q3UH06|RREB1_MOUSE Ras-responsive element-binding protein 1 OS=Mus musculus OX=10090 GN=Rreb1 PE=1 SV=2	RREB1	18.8392587652614	18.1067854446761	18.6746245538634	19.0527609712532
P07742	>sp|P07742|RIR1_MOUSE Ribonucleoside-diphosphate reductase large subunit OS=Mus musculus OX=10090 GN=Rrm1 PE=1 SV=2	RRM1		17.363473250928		18.4712591112403
P56183	>sp|P56183|RRP1_MOUSE Ribosomal RNA processing protein 1 homolog A OS=Mus musculus OX=10090 GN=Rrp1 PE=1 SV=2	RRP1		17.0104887089024	16.8091071837518	16.5135533782919
Q9CYX7	>sp|Q9CYX7|RRP15_MOUSE RRP15-like protein OS=Mus musculus OX=10090 GN=Rrp15 PE=1 SV=2	RRP15	19.9369806029632	19.8162987870044	18.7751627093959	19.5684118458984
Q91YK2	>sp|Q91YK2|RRP1B_MOUSE Ribosomal RNA processing protein 1 homolog B OS=Mus musculus OX=10090 GN=Rrp1b PE=1 SV=2	RRP1B	18.3351327915051	17.9093626758193	18.5348650774181	18.3809492695449
Q3UFY0	>sp|Q3UFY0|RRP36_MOUSE Ribosomal RNA processing protein 36 homolog OS=Mus musculus OX=10090 GN=Rrp36 PE=1 SV=1	RRP36	18.5189672398851	17.3034749785573		18.510718246807
Q9DB85	>sp|Q9DB85|RRP8_MOUSE Ribosomal RNA-processing protein 8 OS=Mus musculus OX=10090 GN=Rrp8 PE=1 SV=1	RRP8	17.9500452753222	17.0465013256435	17.0638611791778	17.6592651839403
Q91WM3	>sp|Q91WM3|U3IP2_MOUSE U3 small nucleolar RNA-interacting protein 2 OS=Mus musculus OX=10090 GN=Rrp9 PE=1 SV=1	RRP9	16.1859408139393	17.3233666520838	16.4193558756185	16.512006138793
Q9CYH6	>sp|Q9CYH6|RRS1_MOUSE Ribosome biogenesis regulatory protein homolog OS=Mus musculus OX=10090 GN=Rrs1 PE=1 SV=1	RRS1	19.0658630917013	18.970995477785	19.0360022103479	18.6816232723152
Q8BVY0	>sp|Q8BVY0|RL1D1_MOUSE Ribosomal L1 domain-containing protein 1 OS=Mus musculus OX=10090 GN=Rsl1d1 PE=1 SV=1	RSL1D1	18.2894425683062	18.1635913176053	18.141819259678	18.2625522300863
Q99L28	>sp|Q99L28|RLP24_MOUSE Probable ribosome biogenesis protein RLP24 OS=Mus musculus OX=10090 GN=Rsl24d1 PE=2 SV=1	RSL24D1	19.5915008496998	17.5624991273878	20.810245301513	20.8188019952463
Q2TJ95	>sp|Q2TJ95|RSPO3_MOUSE R-spondin-3 OS=Mus musculus OX=10090 GN=Rspo3 PE=1 SV=2	RSPO3	20.2441761531167	17.3947245340736	18.720442832646	19.5210850465296
Q9DBU6	>sp|Q9DBU6|RSRC1_MOUSE Serine/Arginine-related protein 53 OS=Mus musculus OX=10090 GN=Rsrc1 PE=1 SV=1	RSRC1	21.0502511356477	18.9831971990935	21.6717825973879	21.2917647869645
A2RTL5	>sp|A2RTL5|RSRC2_MOUSE Arginine/serine-rich coiled-coil protein 2 OS=Mus musculus OX=10090 GN=Rsrc2 PE=2 SV=1	RSRC2		17.0239332656363		16.6981686685507
Q99LF4	>sp|Q99LF4|RTCB_MOUSE RNA-splicing ligase RtcB homolog OS=Mus musculus OX=10090 GN=Rtcb PE=1 SV=1	RTCB	20.3259087613946	20.9092210983972	20.0642114475982	20.6416732818222
A2AQ19	>sp|A2AQ19|RTF1_MOUSE RNA polymerase-associated protein RTF1 homolog OS=Mus musculus OX=10090 GN=Rtf1 PE=1 SV=1	RTF1	18.4498663428195	18.2126027746017	18.3633741503804	18.2718150151488
O70622	>sp|O70622|RTN2_MOUSE Reticulon-2 OS=Mus musculus OX=10090 GN=Rtn2 PE=1 SV=1	RTN2	20.7436488660524	21.7261991537333	20.4004167551092	20.6034113522314
Q9ES97	>sp|Q9ES97|RTN3_MOUSE Reticulon-3 OS=Mus musculus OX=10090 GN=Rtn3 PE=1 SV=2	RTN3		18.9345072993708	17.7435176853974	17.8081682382094
Q99P72	>sp|Q99P72|RTN4_MOUSE Reticulon-4 OS=Mus musculus OX=10090 GN=Rtn4 PE=1 SV=2	RTN4	20.8330563969777	20.8086674333641	20.7712307816209	20.5012801260126
Q9CQE8	>sp|Q9CQE8|RTRAF_MOUSE RNA transcription, translation and transport factor protein OS=Mus musculus OX=10090 GN=RTRAF PE=1 SV=1	RTRAF	21.0772343638618	21.0807522926348	21.3635399573896	
Q8BIJ7	>sp|Q8BIJ7|RUFY1_MOUSE RUN and FYVE domain-containing protein 1 OS=Mus musculus OX=10090 GN=Rufy1 PE=1 SV=1	RUFY1	22.3476911382096	21.2322800294031		21.7895943632066
Q03347	>sp|Q03347|RUNX1_MOUSE Runt-related transcription factor 1 OS=Mus musculus OX=10090 GN=Runx1 PE=1 SV=1	RUNX1	18.7232643212951	17.7714879532765	19.0901421942254	18.9021478164637
Q08775	>sp|Q08775|RUNX2_MOUSE Runt-related transcription factor 2 OS=Mus musculus OX=10090 GN=Runx2 PE=1 SV=2	RUNX2	19.5042178659407	18.1381518809348	19.9309020744091	19.3498368649347
P60122	>sp|P60122|RUVB1_MOUSE RuvB-like 1 OS=Mus musculus OX=10090 GN=Ruvbl1 PE=1 SV=1	RUVBL1	18.8419716258281	18.9458356196266	19.053547794069	18.9822246418061
Q9WTM5	>sp|Q9WTM5|RUVB2_MOUSE RuvB-like 2 OS=Mus musculus OX=10090 GN=Ruvbl2 PE=1 SV=3	RUVBL2	19.5994440494123	20.0218407591247	19.1310305216094	19.639289230796
E9PZQ0	>sp|E9PZQ0|RYR1_MOUSE Ryanodine receptor 1 OS=Mus musculus OX=10090 GN=Ryr1 PE=1 SV=1	RYR1	18.4886112694866	18.867228427336	19.0173097152638	18.8816050917067
P08207	>sp|P08207|S10AA_MOUSE Protein S100-A10 OS=Mus musculus OX=10090 GN=S100a10 PE=1 SV=2	S100A10	20.541621943432	20.7438317589549	20.858667193541	20.1956066161439
P50543	>sp|P50543|S10AB_MOUSE Protein S100-A11 OS=Mus musculus OX=10090 GN=S100a11 PE=1 SV=1	S100A11	20.2261475827665	21.3796746811564	20.7420728304863	20.5482858736141
P97352	>sp|P97352|S10AD_MOUSE Protein S100-A13 OS=Mus musculus OX=10090 GN=S100a13 PE=1 SV=1	S100A13	19.0407364973369	19.5887380187015	19.5241657301812	18.4257400491096
P07091	>sp|P07091|S10A4_MOUSE Protein S100-A4 OS=Mus musculus OX=10090 GN=S100a4 PE=1 SV=1	S100A4	21.1748802262368	22.5018883209712	21.1045606472828	20.978124530717
P14069	>sp|P14069|S10A6_MOUSE Protein S100-A6 OS=Mus musculus OX=10090 GN=S100a6 PE=1 SV=3	S100A6	22.0035653977344	22.2304375752756	22.0510243627574	20.8072675266189
Q9EP69	>sp|Q9EP69|SAC1_MOUSE Phosphatidylinositol-3-phosphatase SAC1 OS=Mus musculus OX=10090 GN=Sacm1l PE=1 SV=1	SACM1L	19.6921779833501	19.8802731536289	19.8657241059794	20.0013641413411
Q9R1T2	>sp|Q9R1T2|SAE1_MOUSE SUMO-activating enzyme subunit 1 OS=Mus musculus OX=10090 GN=Sae1 PE=1 SV=1	SAE1	19.3323521416625	19.0309694564693	19.2809923410964	19.2683816218688
D3YXK2	>sp|D3YXK2|SAFB1_MOUSE Scaffold attachment factor B1 OS=Mus musculus OX=10090 GN=Safb PE=1 SV=2	SAFB	19.2484772979174	19.8169856223445	19.354118673552	19.5474176007718
Q80YR5	>sp|Q80YR5|SAFB2_MOUSE Scaffold attachment factor B2 OS=Mus musculus OX=10090 GN=Safb2 PE=1 SV=2	SAFB2	19.1885644075683	19.3948985202868	19.1343810257367	19.2818410529507
Q8CBY1	>sp|Q8CBY1|SMAG1_MOUSE Protein Smaug homolog 1 OS=Mus musculus OX=10090 GN=Samd4a PE=1 SV=2	SAMD4A	18.7352192394437	18.4524094051815	18.6318029145923	18.1743423277567
Q60710	>sp|Q60710|SAMH1_MOUSE Deoxynucleoside triphosphate triphosphohydrolase SAMHD1 OS=Mus musculus OX=10090 GN=Samhd1 PE=1 SV=3	SAMHD1	19.0082229895311	18.2735470202242	18.7555071929974	19.07709944722
Q8BIH0	>sp|Q8BIH0|SP130_MOUSE Histone deacetylase complex subunit SAP130 OS=Mus musculus OX=10090 GN=Sap130 PE=1 SV=2	SAP130	17.2756480196457	17.8407907138348	18.4836140846666	17.7120498927473
O55128	>sp|O55128|SAP18_MOUSE Histone deacetylase complex subunit SAP18 OS=Mus musculus OX=10090 GN=Sap18 PE=1 SV=1	SAP18	19.130250197268	18.8952121363135	19.5555596615933	19.4547222145105
P36536	>sp|P36536|SAR1A_MOUSE Small COPII coat GTPase SAR1A OS=Mus musculus OX=10090 GN=Sar1a PE=1 SV=1	SAR1A	20.2761644189384	21.09597721185	19.9940281840406	20.5699528220481
Q8R3Q0	>sp|Q8R3Q0|SARAF_MOUSE Store-operated calcium entry-associated regulatory factor OS=Mus musculus OX=10090 GN=Saraf PE=1 SV=2	SARAF	19.2683984917172	19.5588941045791	19.1883934192917	19.5349433726326
Q9D1J3	>sp|Q9D1J3|SARNP_MOUSE SAP domain-containing ribonucleoprotein OS=Mus musculus OX=10090 GN=Sarnp PE=1 SV=3	SARNP	21.2053530523269	20.8221547037951	21.4030901378476	21.171124425723
P26638	>sp|P26638|SYSC_MOUSE Serine--tRNA ligase, cytoplasmic OS=Mus musculus OX=10090 GN=Sars1 PE=1 SV=3	SARS1	21.5604483402965	20.8126096750751	21.3465940337339	21.3216025907021
Q9JJL8	>sp|Q9JJL8|SYSM_MOUSE Serine--tRNA ligase, mitochondrial OS=Mus musculus OX=10090 GN=Sars2 PE=1 SV=2	SARS2	19.4145693454223			19.1608512086533
Q9Z315	>sp|Q9Z315|SNUT1_MOUSE U4/U6.U5 tri-snRNP-associated protein 1 OS=Mus musculus OX=10090 GN=Sart1 PE=1 SV=1	SART1	20.0643862286199	19.6143730858327	19.7685397916096	19.9146066384729
Q9JLI8	>sp|Q9JLI8|SART3_MOUSE Squamous cell carcinoma antigen recognized by T-cells 3 OS=Mus musculus OX=10090 GN=Sart3 PE=1 SV=1	SART3	19.9677352370302	19.7273051556246	19.9051260788108	19.8672960902025
P59808	>sp|P59808|SASH1_MOUSE SAM and SH3 domain-containing protein 1 OS=Mus musculus OX=10090 GN=Sash1 PE=1 SV=1	SASH1	19.0901305344399	18.3094313173057	18.7866932897113	18.9677937134348
Q8VEB2	>sp|Q8VEB2|SAV1_MOUSE Protein salvador homolog 1 OS=Mus musculus OX=10090 GN=Sav1 PE=1 SV=2	SAV1	18.199487489424	18.727470429187	17.1663165200819	
Q8K190	>sp|Q8K190|SAYS1_MOUSE SAYSvFN domain-containing protein 1 OS=Mus musculus OX=10090 GN=Saysd1 PE=1 SV=1	SAYSD1	16.7721723507431	13.5848056484473	17.0882429134467	17.5787213563211
P70122	>sp|P70122|SBDS_MOUSE Ribosome maturation protein SBDS OS=Mus musculus OX=10090 GN=Sbds PE=1 SV=4	SBDS	20.3047177386811	20.55141138327	19.9248192965971	20.5793163874513
Q6ZPE2	>sp|Q6ZPE2|MTMR5_MOUSE Myotubularin-related protein 5 OS=Mus musculus OX=10090 GN=Sbf1 PE=1 SV=2	SBF1	20.3452159349129	19.4200198408757	20.3156956316496	20.0629216436431
Q689Z5	>sp|Q689Z5|SBNO1_MOUSE Protein strawberry notch homolog 1 OS=Mus musculus OX=10090 GN=Sbno1 PE=1 SV=2	SBNO1	21.8913452702598	21.9220761033404	21.4261161163501	21.7453366887841
Q5U4C3	>sp|Q5U4C3|SFR19_MOUSE Splicing factor, arginine/serine-rich 19 OS=Mus musculus OX=10090 GN=Scaf1 PE=1 SV=1	SCAF1	19.8478481624232	18.7319208370344	19.9297115975837	19.9151555254515
E9PZM7	>tr|E9PZM7|E9PZM7_MOUSE SR-related CTD-associated factor 11 OS=Mus musculus OX=10090 GN=Scaf11 PE=1 SV=1	SCAF11	19.4399632353416	18.1569710389146	19.4137175219636	19.475290267484
Q6DID3	>sp|Q6DID3|SCAF8_MOUSE SR-related and CTD-associated factor 8 OS=Mus musculus OX=10090 GN=Scaf8 PE=1 SV=1	SCAF8		18.9939730212601		18.8073453446338
O35609	>sp|O35609|SCAM3_MOUSE Secretory carrier-associated membrane protein 3 OS=Mus musculus OX=10090 GN=Scamp3 PE=1 SV=3	SCAMP3	20.1052296113941	19.7156485571183	20.1943586999417	19.7908478714729
O35114	>sp|O35114|SCRB2_MOUSE Lysosome membrane protein 2 OS=Mus musculus OX=10090 GN=Scarb2 PE=1 SV=3	SCARB2	19.6719083996199	20.2488227184011	20.0251778144236	20.2626121755987
P59222	>sp|P59222|SREC2_MOUSE Scavenger receptor class F member 2 OS=Mus musculus OX=10090 GN=Scarf2 PE=1 SV=1	SCARF2	20.6056773617802	19.7932339790512	20.3110844010451	19.9624486962916
Q8R127	>sp|Q8R127|SCPDL_MOUSE Saccharopine dehydrogenase-like oxidoreductase OS=Mus musculus OX=10090 GN=Sccpdh PE=1 SV=1	SCCPDH	18.4295274338706	19.0270180257697	19.0062803119483	18.788526938037
Q8BRF7	>sp|Q8BRF7|SCFD1_MOUSE Sec1 family domain-containing protein 1 OS=Mus musculus OX=10090 GN=Scfd1 PE=1 SV=1	SCFD1	19.6027085379736	18.9344406544421	19.4499593540874	19.319367244146
B1AWN6	>sp|B1AWN6|SCN2A_MOUSE Sodium channel protein type 2 subunit alpha OS=Mus musculus OX=10090 GN=Scn2a PE=1 SV=1	SCN2A		19.1773373797106	20.6647235769541	18.3210108766456
Q9JJV9	>sp|Q9JJV9|SCN5A_MOUSE Sodium channel protein type 5 subunit alpha OS=Mus musculus OX=10090 GN=Scn5a PE=1 SV=2	SCN5A		15.9509543349362	16.3327684242988	
Q5SUC9	>sp|Q5SUC9|SCO1_MOUSE Protein SCO1 homolog, mitochondrial OS=Mus musculus OX=10090 GN=Sco1 PE=1 SV=1	SCO1		19.953729257987	19.7413604665248	19.6531599495924
P32020	>sp|P32020|SCP2_MOUSE Sterol carrier protein 2 OS=Mus musculus OX=10090 GN=Scp2 PE=1 SV=3	SCP2	20.1782240254975	20.757412273651	20.0079001375309	20.4337157855344
Q920A5	>sp|Q920A5|RISC_MOUSE Retinoid-inducible serine carboxypeptidase OS=Mus musculus OX=10090 GN=Scpep1 PE=1 SV=2	SCPEP1	19.4258117142867	18.8347666075766	19.4543897420826	19.5411923314938
Q80U72	>sp|Q80U72|SCRIB_MOUSE Protein scribble homolog OS=Mus musculus OX=10090 GN=Scrib PE=1 SV=3	SCRIB	18.6938128177542	18.3992853449946	18.9968851357328	18.945821283599
Q9CZC8	>sp|Q9CZC8|SCRN1_MOUSE Secernin-1 OS=Mus musculus OX=10090 GN=Scrn1 PE=1 SV=1	SCRN1	17.4965479217566	17.5909667948112	17.7762876671031	17.313480138127
Q9EQC5	>sp|Q9EQC5|SCYL1_MOUSE N-terminal kinase-like protein OS=Mus musculus OX=10090 GN=Scyl1 PE=1 SV=1	SCYL1	18.680837918219	19.3058156418208		19.4379323618298
Q80UZ2	>sp|Q80UZ2|SDA1_MOUSE Protein SDA1 homolog OS=Mus musculus OX=10090 GN=Sdad1 PE=1 SV=1	SDAD1	20.1685693235245	18.9097436255947	19.8640649119671	19.8056238841503
O08992	>sp|O08992|SDCB1_MOUSE Syntenin-1 OS=Mus musculus OX=10090 GN=Sdcbp PE=1 SV=1	SDCBP	21.1753785611153	20.1350969738581	21.7049144938204	20.8833566879392
Q9DCT5	>sp|Q9DCT5|SDF2_MOUSE Stromal cell-derived factor 2 OS=Mus musculus OX=10090 GN=Sdf2 PE=1 SV=1	SDF2	21.8016974913957	21.2789860091441	22.0628375672515	21.3654175342905
Q9ESP1	>sp|Q9ESP1|SDF2L_MOUSE Stromal cell-derived factor 2-like protein 1 OS=Mus musculus OX=10090 GN=Sdf2l1 PE=1 SV=2	SDF2L1	21.0411307648614	19.1027344769042	21.948968678692	
Q61112	>sp|Q61112|CAB45_MOUSE 45 kDa calcium-binding protein OS=Mus musculus OX=10090 GN=Sdf4 PE=1 SV=1	SDF4	19.8822211836207	19.9559050143834	19.9133887366754	19.7769834362335
Q8K2B3	>sp|Q8K2B3|SDHA_MOUSE Succinate dehydrogenase [ubiquinone] flavoprotein subunit, mitochondrial OS=Mus musculus OX=10090 GN=Sdha PE=1 SV=1	SDHA	19.5253823831103	19.5394138545076	19.7477246575735	19.6747084909853
Q3U276	>sp|Q3U276|SDHF1_MOUSE Succinate dehydrogenase assembly factor 1, mitochondrial OS=Mus musculus OX=10090 GN=Sdhaf1 PE=1 SV=1	SDHAF1	19.0360872131014	18.677969408252	18.9479673456785	19.2608689872323
Q9CQA3	>sp|Q9CQA3|SDHB_MOUSE Succinate dehydrogenase [ubiquinone] iron-sulfur subunit, mitochondrial OS=Mus musculus OX=10090 GN=Sdhb PE=1 SV=1	SDHB	20.318334089602	20.6522077090198	20.6025665948549	20.664449749194
Q9CXV1	>sp|Q9CXV1|DHSD_MOUSE Succinate dehydrogenase [ubiquinone] cytochrome b small subunit, mitochondrial OS=Mus musculus OX=10090 GN=Sdhd PE=1 SV=2	SDHD		17.3572951449505	18.7225282045	
Q9R0P6	>sp|Q9R0P6|SC11A_MOUSE Signal peptidase complex catalytic subunit SEC11A OS=Mus musculus OX=10090 GN=Sec11a PE=1 SV=1	SEC11A	20.1614378527801	19.0202850218972	20.0443826406794	19.7982684293651
Q9D1M0	>sp|Q9D1M0|SEC13_MOUSE Protein SEC13 homolog OS=Mus musculus OX=10090 GN=Sec13 PE=1 SV=3	SEC13		18.9936107859387		18.182343722774
E9QAT4	>sp|E9QAT4|SC16A_MOUSE Protein transport protein Sec16A OS=Mus musculus OX=10090 GN=Sec16a PE=1 SV=1	SEC16A	20.3377510602703	19.6556034379599	20.465399195385	20.2716306412181
O08547	>sp|O08547|SC22B_MOUSE Vesicle-trafficking protein SEC22b OS=Mus musculus OX=10090 GN=Sec22b PE=1 SV=3	SEC22B	20.9051867133646	19.9269513891257	20.6516631857938	20.6988158302627
Q01405	>sp|Q01405|SC23A_MOUSE Protein transport protein Sec23A OS=Mus musculus OX=10090 GN=Sec23a PE=1 SV=2	SEC23A	21.2191644449805	20.8946402395492	21.6482049219802	21.7963538176011
Q9D662	>sp|Q9D662|SC23B_MOUSE Protein transport protein Sec23B OS=Mus musculus OX=10090 GN=Sec23b PE=1 SV=1	SEC23B	17.2381003329218	17.3007257556067	18.7391462435457	18.2679572436531
Q6NZC7	>sp|Q6NZC7|S23IP_MOUSE SEC23-interacting protein OS=Mus musculus OX=10090 GN=Sec23ip PE=1 SV=2	SEC23IP	19.2870939989766	19.1292778908126	18.9915795443036	19.5795457921275
Q3U2P1	>sp|Q3U2P1|SC24A_MOUSE Protein transport protein Sec24A OS=Mus musculus OX=10090 GN=Sec24a PE=1 SV=1	SEC24A	20.1834396819371	19.9417570142216		20.3449080632931
A0A286YDI8;G3X972	>tr|A0A286YDI8|A0A286YDI8_MOUSE Isoform of G3X972, SEC24 homolog C, COPII coat complex component OS=Mus musculus OX=10090 GN=Sec24c PE=1 SV=1;>tr|G3X972|G3X972_MOUSE SEC24 homolog C, COPII coat complex component OS=Mus musculus OX=10090 GN=Sec24c PE=1 SV=1	SEC24C	18.0699136625624	18.3321526730095	18.0053327045616	17.6952952327352
Q6NXL1	>tr|Q6NXL1|Q6NXL1_MOUSE SEC24 homolog D, COPII coat complex component OS=Mus musculus OX=10090 GN=Sec24d PE=1 SV=1	SEC24D		18.2773029600096	17.4089229990708	
Q3UPL0	>sp|Q3UPL0|SC31A_MOUSE Protein transport protein Sec31A OS=Mus musculus OX=10090 GN=Sec31a PE=1 SV=2	SEC31A	19.8286902423116	19.6581943888536	19.74948602945	19.7444464590803
Q9CQS8	>sp|Q9CQS8|SC61B_MOUSE Protein transport protein Sec61 subunit beta OS=Mus musculus OX=10090 GN=Sec61b PE=1 SV=3	SEC61B	18.153698232248	18.4005206306259	18.4747723211716	18.9126883990336
Q8BU14	>sp|Q8BU14|SEC62_MOUSE Translocation protein SEC62 OS=Mus musculus OX=10090 GN=Sec62 PE=1 SV=1	SEC62		19.0185744277835		17.5035341365226
Q8VHE0	>sp|Q8VHE0|SEC63_MOUSE Translocation protein SEC63 homolog OS=Mus musculus OX=10090 GN=Sec63 PE=1 SV=4	SEC63	19.6499856120667	19.0615882016314	19.8167723811709	20.0147142922411
P17563;Q63836	>sp|P17563|SBP1_MOUSE Methanethiol oxidase OS=Mus musculus OX=10090 GN=Selenbp1 PE=1 SV=2;>sp|Q63836|SBP2_MOUSE Selenium-binding protein 2 OS=Mus musculus OX=10090 GN=Selenbp2 PE=1 SV=2	SELENBP1;SELENBP2	17.5521760634973	17.4741458369455	16.897764259358	16.6213650404699
Q9DBC0	>sp|Q9DBC0|SELO_MOUSE Protein adenylyltransferase SelO, mitochondrial OS=Mus musculus OX=10090 GN=Selenoo PE=1 SV=4	SELENOO	20.6427464198109	18.563320496739	19.278378842253	20.4796182890874
P70274	>sp|P70274|SEPP1_MOUSE Selenoprotein P OS=Mus musculus OX=10090 GN=Selenop PE=1 SV=3	SELENOP		19.9293009859359	19.8348060868909	19.9740742617702
P60897	>sp|P60897|SEM1_MOUSE 26S proteasome complex subunit SEM1 OS=Mus musculus OX=10090 GN=Sem1 PE=3 SV=1	SEM1	19.1832528562904	17.4336936038852	20.0908815702854	18.9001604027793
Q62181	>sp|Q62181|SEM3C_MOUSE Semaphorin-3C OS=Mus musculus OX=10090 GN=Sema3c PE=1 SV=2	SEMA3C	18.7555206449541	18.203527836603	18.1637058571084	
Q8BUH8	>sp|Q8BUH8|SENP7_MOUSE Sentrin-specific protease 7 OS=Mus musculus OX=10090 GN=Senp7 PE=1 SV=1	SENP7	19.8158425954064	19.1475651598396	19.7841181790289	19.4736946106343
Q8BH69	>sp|Q8BH69|SPS1_MOUSE Selenide, water dikinase 1 OS=Mus musculus OX=10090 GN=Sephs1 PE=1 SV=1	SEPHS1	20.1238959375237	18.6995496102541	19.8230177049554	19.9236952009993
Q8C1B7	>sp|Q8C1B7|SEP11_MOUSE Septin-11 OS=Mus musculus OX=10090 GN=Septin11 PE=1 SV=4	SEPTIN11	19.0487806417783	19.7505490696775	19.3393178589559	19.4854650663781
P42208	>sp|P42208|SEPT2_MOUSE Septin-2 OS=Mus musculus OX=10090 GN=Septin2 PE=1 SV=2	SEPTIN2	19.9708843512272	20.1489859999217	20.0442134976765	20.0936382681292
P28661	>sp|P28661|SEPT4_MOUSE Septin-4 OS=Mus musculus OX=10090 GN=Septin4 PE=1 SV=1	SEPTIN4	16.529055799494	17.1624594841437		16.5381000069526
E9Q1G8	>tr|E9Q1G8|E9Q1G8_MOUSE Isoform of O55131, Septin OS=Mus musculus OX=10090 GN=Septin7 PE=1 SV=2	SEPTIN7	19.8024616381955	20.0142905850434	20.0588209978432	19.82315038307
Q8CHH9	>sp|Q8CHH9|SEPT8_MOUSE Septin-8 OS=Mus musculus OX=10090 GN=Septin8 PE=1 SV=4	SEPTIN8	20.0915442271976	19.1162165977566	20.9595775952265	20.1555231166935
Q80UG5	>sp|Q80UG5|SEPT9_MOUSE Septin-9 OS=Mus musculus OX=10090 GN=Septin9 PE=1 SV=1	SEPTIN9	19.5172830368419	19.9126639162574	19.5076629153023	19.4380571788313
Q9CY58	>sp|Q9CY58|SERB1_MOUSE SERPINE1 mRNA-binding protein 1 OS=Mus musculus OX=10090 GN=Serbp1 PE=1 SV=2	SERBP1	19.5184448405913	19.479911400796	19.9403149994872	19.5555215478847
Q9DCQ7	>sp|Q9DCQ7|A1AT6_MOUSE Alpha-1-antitrypsin 1-6 OS=Mus musculus OX=10090 GN=Serpina1f PE=2 SV=1	SERPINA1F		19.9533137895484		19.6398195368072
Q9D154	>sp|Q9D154|ILEUA_MOUSE Leukocyte elastase inhibitor A OS=Mus musculus OX=10090 GN=Serpinb1a PE=1 SV=1	SERPINB1A	20.8664924515152	21.4003278592701		20.1555547298395
Q60854	>sp|Q60854|SPB6_MOUSE Serpin B6 OS=Mus musculus OX=10090 GN=Serpinb6 PE=1 SV=1	SERPINB6	19.1319378090729	19.3122328659934	19.3060286794543	19.2924207608027
P32261	>sp|P32261|ANT3_MOUSE Antithrombin-III OS=Mus musculus OX=10090 GN=Serpinc1 PE=1 SV=1	SERPINC1	17.0622588864923	16.7732982759847		16.8976488396757
