protein_id	fasta_headers	gene_symbols_or_id	MS1d4-L	MS2d4-L	MW1d4-L	MW2d4-L
Q9D2G2	>sp|Q9D2G2|ODO2_MOUSE Dihydrolipoyllysine-residue succinyltransferase component of 2-oxoglutarate dehydrogenase complex, mitochondrial OS=Mus musculus OX=10090 GN=Dlst PE=1 SV=1	DLST	20.6733065655641	21.5299166006415	20.5165253923675	21.1321312344618
P11531	>sp|P11531|DMD_MOUSE Dystrophin OS=Mus musculus OX=10090 GN=Dmd PE=1 SV=3	DMD	19.7079134263333	20.1025212939178	19.499723050336	19.6766702742366
Q8R368	>sp|Q8R368|DAAF4_MOUSE Dynein axonemal assembly factor 4 OS=Mus musculus OX=10090 GN=Dnaaf4 PE=1 SV=2	DNAAF4	16.1199645414636	14.0694272003163	17.2393029681323	16.219632315161
B9EJR8	>sp|B9EJR8|DAAF5_MOUSE Dynein axonemal assembly factor 5 OS=Mus musculus OX=10090 GN=Dnaaf5 PE=1 SV=1	DNAAF5		19.4071054448396	19.5353828593045	19.5929415100885
P63037	>sp|P63037|DNJA1_MOUSE DnaJ homolog subfamily A member 1 OS=Mus musculus OX=10090 GN=Dnaja1 PE=1 SV=1	DNAJA1		19.5101946088662	18.7297148235372	18.2278639288189
Q9QYJ3	>sp|Q9QYJ3|DNJB1_MOUSE DnaJ homolog subfamily B member 1 OS=Mus musculus OX=10090 GN=Dnajb1 PE=1 SV=3	DNAJB1	21.0790146624643	19.6962073648748	22.0299473292836	20.8293706905814
Q99KV1	>sp|Q99KV1|DJB11_MOUSE DnaJ homolog subfamily B member 11 OS=Mus musculus OX=10090 GN=Dnajb11 PE=1 SV=1	DNAJB11	20.277816142407	19.9696394150972	20.9206652798766	20.5537686738074
Q9QYI4	>sp|Q9QYI4|DJB12_MOUSE DnaJ homolog subfamily B member 12 OS=Mus musculus OX=10090 GN=Dnajb12 PE=1 SV=2	DNAJB12	18.731753731439	18.0997480043412	17.8620651033643	18.9098877248568
Q9QYI5	>sp|Q9QYI5|DNJB2_MOUSE DnaJ homolog subfamily B member 2 OS=Mus musculus OX=10090 GN=Dnajb2 PE=1 SV=3	DNAJB2	19.1235271165858	18.3241290449539	19.6251535225011	19.6078463708372
Q9D832	>sp|Q9D832|DNJB4_MOUSE DnaJ homolog subfamily B member 4 OS=Mus musculus OX=10090 GN=Dnajb4 PE=1 SV=1	DNAJB4	18.8836663022761	19.6652533010236	18.6641023314623	19.544193735758
O54946	>sp|O54946|DNJB6_MOUSE DnaJ homolog subfamily B member 6 OS=Mus musculus OX=10090 GN=Dnajb6 PE=1 SV=4	DNAJB6	20.3018355778585	18.7595924497612	20.3797643497058	20.0885296957257
Q61712	>sp|Q61712|DNJC1_MOUSE DnaJ homolog subfamily C member 1 OS=Mus musculus OX=10090 GN=Dnajc1 PE=1 SV=1	DNAJC1	19.6452080728504	19.755438186667	19.1596622664408	19.3584950365209
D4AFX7;G3X922	>tr|D4AFX7|D4AFX7_MOUSE DnaJ heat shock protein family (Hsp40) member C13 OS=Mus musculus OX=10090 GN=Dnajc13 PE=1 SV=1;>tr|G3X922|G3X922_MOUSE Isoform of D4AFX7, DnaJ heat shock protein family (Hsp40) member C13 OS=Mus musculus OX=10090 GN=Dnajc13 PE=1 SV=1	DNAJC13	20.7336086215838	19.8586127187892	21.0560915301213	20.9252788110346
Q9CQV7	>sp|Q9CQV7|TIM14_MOUSE Mitochondrial import inner membrane translocase subunit TIM14 OS=Mus musculus OX=10090 GN=Dnajc19 PE=1 SV=3	DNAJC19	19.9135003230499	18.3674745522288	20.3098305697396	19.762664819757
P54103	>sp|P54103|DNJC2_MOUSE DnaJ homolog subfamily C member 2 OS=Mus musculus OX=10090 GN=Dnajc2 PE=1 SV=2	DNAJC2	18.5459473363105	19.9440980898565		18.8763952552834
E9Q8D0	>sp|E9Q8D0|DJC21_MOUSE DnaJ homolog subfamily C member 21 OS=Mus musculus OX=10090 GN=Dnajc21 PE=1 SV=1	DNAJC21		18.7118358103789	16.6573145602549	16.3267355299952
A2ALW5	>sp|A2ALW5|DJC25_MOUSE DnaJ homolog subfamily C member 25 OS=Mus musculus OX=10090 GN=Dnajc25 PE=1 SV=1	DNAJC25	19.3856133380134	18.4837991139821	19.8286963120403	19.2766312129169
Q91YW3	>sp|Q91YW3|DNJC3_MOUSE DnaJ homolog subfamily C member 3 OS=Mus musculus OX=10090 GN=Dnajc3 PE=1 SV=1	DNAJC3	18.4977271233523	18.28989986724	18.9367999161585	18.4142318304132
Q9QYI3	>sp|Q9QYI3|DNJC7_MOUSE DnaJ homolog subfamily C member 7 OS=Mus musculus OX=10090 GN=Dnajc7 PE=1 SV=2	DNAJC7	18.9774562644869	18.3905331170204	19.0317410373842	17.9602566108231
Q6NZB0	>sp|Q6NZB0|DNJC8_MOUSE DnaJ homolog subfamily C member 8 OS=Mus musculus OX=10090 GN=Dnajc8 PE=1 SV=2	DNAJC8	18.485388349228	18.7755417745219	19.2645224973503	18.6705958996797
Q91WN1	>sp|Q91WN1|DNJC9_MOUSE DnaJ homolog subfamily C member 9 OS=Mus musculus OX=10090 GN=Dnajc9 PE=1 SV=2	DNAJC9	18.6647515331595	18.5566081451625	18.1426658798446	18.2402466142075
Q8K1M6	>sp|Q8K1M6|DNM1L_MOUSE Dynamin-1-like protein OS=Mus musculus OX=10090 GN=Dnm1l PE=1 SV=3	DNM1L	19.3572224749054	19.6271556073489	19.6072498629916	19.5413679334155
P39054	>sp|P39054|DYN2_MOUSE Dynamin-2 OS=Mus musculus OX=10090 GN=Dnm2 PE=1 SV=2	DNM2	20.5631764367876	20.9121913372703	20.2498716521267	20.4234546434955
Q9Z2W0	>sp|Q9Z2W0|DNPEP_MOUSE Aspartyl aminopeptidase OS=Mus musculus OX=10090 GN=Dnpep PE=1 SV=2	DNPEP	19.2233455499553	19.1711587404045	19.2113686556232	19.4206692354237
Q99LB0	>sp|Q99LB0|TDIF1_MOUSE Deoxynucleotidyltransferase terminal-interacting protein 1 OS=Mus musculus OX=10090 GN=Dnttip1 PE=1 SV=1	DNTTIP1	18.9925376669085	18.6161048379857		18.1364378935294
Q8R2M2	>sp|Q8R2M2|TDIF2_MOUSE Deoxynucleotidyltransferase terminal-interacting protein 2 OS=Mus musculus OX=10090 GN=Dnttip2 PE=1 SV=1	DNTTIP2	23.9515267152253	24.0477274734248	24.1739681051205	23.8863273816806
Q8BUR4	>sp|Q8BUR4|DOCK1_MOUSE Dedicator of cytokinesis protein 1 OS=Mus musculus OX=10090 GN=Dock1 PE=1 SV=3	DOCK1	18.6155388317419	17.6945289942096	18.6828675226109	17.912739707067
B2RY04	>sp|B2RY04|DOCK5_MOUSE Dedicator of cytokinesis protein 5 OS=Mus musculus OX=10090 GN=Dock5 PE=1 SV=2	DOCK5	17.3679077689256	15.8764537131653	17.9676790926079	17.3465407936684
Q8R1A4	>sp|Q8R1A4|DOCK7_MOUSE Dedicator of cytokinesis protein 7 OS=Mus musculus OX=10090 GN=Dock7 PE=1 SV=3	DOCK7	20.1597781213479	18.7207373375716	20.1155650472656	19.9821341338
Q99LN9	>sp|Q99LN9|DOHH_MOUSE Deoxyhypusine hydroxylase OS=Mus musculus OX=10090 GN=Dohh PE=1 SV=2	DOHH	19.4253959077918	19.638930219443	19.1549353380886	19.528271605247
P97465	>sp|P97465|DOK1_MOUSE Docking protein 1 OS=Mus musculus OX=10090 GN=Dok1 PE=1 SV=2	DOK1	18.9411217947482	19.0004962425988	19.177981272594	19.6376464464656
Q8BPA8	>sp|Q8BPA8|DPCD_MOUSE Protein DPCD OS=Mus musculus OX=10090 GN=Dpcd PE=1 SV=1	DPCD	20.6465180432707	19.2553084687258		19.8685503631329
Q61103	>sp|Q61103|REQU_MOUSE Zinc finger protein ubi-d4 OS=Mus musculus OX=10090 GN=Dpf2 PE=1 SV=1	DPF2	17.901027328607	17.971234989886	18.1662658725228	
Q9D1Q4	>sp|Q9D1Q4|DPM3_MOUSE Dolichol-phosphate mannosyltransferase subunit 3 OS=Mus musculus OX=10090 GN=Dpm3 PE=1 SV=1	DPM3	18.1291334803848	17.6042249730911	18.7846241601172	17.7030208881381
Q9ET22	>sp|Q9ET22|DPP2_MOUSE Dipeptidyl peptidase 2 OS=Mus musculus OX=10090 GN=Dpp7 PE=1 SV=2	DPP7		17.5928131797516		16.5716071151431
O08553	>sp|O08553|DPYL2_MOUSE Dihydropyrimidinase-related protein 2 OS=Mus musculus OX=10090 GN=Dpysl2 PE=1 SV=2	DPYSL2	20.3799750265865	20.7162144530437	20.2510854281497	20.3354633653092
E9PWE8	>tr|E9PWE8|E9PWE8_MOUSE Isoform of Q62188, Dihydropyrimidinase-like 3 OS=Mus musculus OX=10090 GN=Dpysl3 PE=1 SV=1	DPYSL3	20.2051365472105	20.4584196168462	19.9801811647607	20.1063378618335
Q9EQF6	>sp|Q9EQF6|DPYL5_MOUSE Dihydropyrimidinase-related protein 5 OS=Mus musculus OX=10090 GN=Dpysl5 PE=1 SV=1	DPYSL5	18.4964678371621		19.7829377834817	19.0246711528101
Q9D6N5	>sp|Q9D6N5|NC2A_MOUSE Dr1-associated corepressor OS=Mus musculus OX=10090 GN=Drap1 PE=1 SV=3	DRAP1		16.9457591313139		16.9931020792657
P32233	>sp|P32233|DRG1_MOUSE Developmentally-regulated GTP-binding protein 1 OS=Mus musculus OX=10090 GN=Drg1 PE=1 SV=1	DRG1	19.0067452816998	19.413922281785	18.8843951144973	19.1321945402581
S4R1P5	>tr|S4R1P5|S4R1P5_MOUSE Isoform of Q91ZU6, Dystonin OS=Mus musculus OX=10090 GN=Dst PE=1 SV=1	DST	18.9317570002339	19.410580901695	19.038949587527	18.9124991028763
Q9R0P5	>sp|Q9R0P5|DEST_MOUSE Destrin OS=Mus musculus OX=10090 GN=Dstn PE=1 SV=3	DSTN	21.7045480841389	22.8194159254571	21.5975512096894	21.7743021818268
Q9DD18	>sp|Q9DD18|DTD1_MOUSE D-aminoacyl-tRNA deacylase 1 OS=Mus musculus OX=10090 GN=Dtd1 PE=1 SV=2	DTD1	17.3864990237961	16.5342293281619	18.4855865953943	17.844207850437
Q9D2N4	>sp|Q9D2N4|DTNA_MOUSE Dystrobrevin alpha OS=Mus musculus OX=10090 GN=Dtna PE=1 SV=2	DTNA	17.6194188806783	18.1233688930123	17.4436438902612	18.0367867504492
P97930	>sp|P97930|KTHY_MOUSE Thymidylate kinase OS=Mus musculus OX=10090 GN=Dtymk PE=1 SV=2	DTYMK	20.8298050419297	20.3227360031778	21.2592373978568	20.6457056765541
Q8C2P3	>sp|Q8C2P3|DUS1L_MOUSE tRNA-dihydrouridine(16/17) synthase [NAD(P)(+)]-like OS=Mus musculus OX=10090 GN=Dus1l PE=2 SV=1	DUS1L	18.169254763808		17.9193135391809	
Q91XI1	>sp|Q91XI1|DUS3L_MOUSE tRNA-dihydrouridine(47) synthase [NAD(P)(+)]-like OS=Mus musculus OX=10090 GN=Dus3l PE=1 SV=1	DUS3L	20.0644263077542	19.0295346379907	19.5632676260766	19.4953794608971
Q6NT99	>sp|Q6NT99|DUS23_MOUSE Dual specificity protein phosphatase 23 OS=Mus musculus OX=10090 GN=Dusp23 PE=1 SV=1	DUSP23	20.9054783217939	20.1889323032726	20.6464987137967	21.1670365307669
Q8BTR5	>sp|Q8BTR5|DUS28_MOUSE Dual specificity phosphatase 28 OS=Mus musculus OX=10090 GN=Dusp28 PE=1 SV=1	DUSP28	21.4360604827362	19.9106154495355	21.4732497016583	21.6987600846628
Q9D7X3	>sp|Q9D7X3|DUS3_MOUSE Dual specificity protein phosphatase 3 OS=Mus musculus OX=10090 GN=Dusp3 PE=1 SV=1	DUSP3	20.1714048439683	20.2825751771573	20.2066948361839	20.3568461509736
Q9CQ43	>sp|Q9CQ43|DUT_MOUSE Deoxyuridine 5'-triphosphate nucleotidohydrolase OS=Mus musculus OX=10090 GN=Dut PE=1 SV=1	DUT	19.7767212094397	18.9778764045861	20.100783293222	19.55511201727
P51141	>sp|P51141|DVL1_MOUSE Segment polarity protein dishevelled homolog DVL-1 OS=Mus musculus OX=10090 GN=Dvl1 PE=1 SV=2	DVL1	18.2652982348516	18.3786927894944	16.3846914148605	
Q9JHU4	>sp|Q9JHU4|DYHC1_MOUSE Cytoplasmic dynein 1 heavy chain 1 OS=Mus musculus OX=10090 GN=Dync1h1 PE=1 SV=2	DYNC1H1	19.046651197003	19.3412015611695	19.1221280572404	19.1752704679442
O88487	>sp|O88487|DC1I2_MOUSE Cytoplasmic dynein 1 intermediate chain 2 OS=Mus musculus OX=10090 GN=Dync1i2 PE=1 SV=1	DYNC1I2	16.7566132091579	18.1232959155514	17.1671524995643	
Q8R1Q8	>sp|Q8R1Q8|DC1L1_MOUSE Cytoplasmic dynein 1 light intermediate chain 1 OS=Mus musculus OX=10090 GN=Dync1li1 PE=1 SV=1	DYNC1LI1	18.5420142946304	18.4512017407555	18.6553413921532	18.4765217738651
P63168	>sp|P63168|DYL1_MOUSE Dynein light chain 1, cytoplasmic OS=Mus musculus OX=10090 GN=Dynll1 PE=1 SV=1	DYNLL1		16.9046841450907		17.0894341673677
P62627	>sp|P62627|DLRB1_MOUSE Dynein light chain roadblock-type 1 OS=Mus musculus OX=10090 GN=Dynlrb1 PE=1 SV=3	DYNLRB1	24.4287841333659	23.4717955958418	24.4468496382942	24.2812152582804
Q9Z188	>sp|Q9Z188|DYR1B_MOUSE Dual specificity tyrosine-phosphorylation-regulated kinase 1B OS=Mus musculus OX=10090 GN=Dyrk1b PE=1 SV=3	DYRK1B	20.4229243625077	19.9072506217988		20.4623209585098
A0A0N4SUJ2;A0A0N4SUN3;A0A0N4SVX9;E9PXU9	>tr|A0A0N4SUJ2|A0A0N4SUJ2_MOUSE Isoform of Q9ESD7, Dysferlin OS=Mus musculus OX=10090 GN=Dysf PE=1 SV=1;>tr|A0A0N4SUN3|A0A0N4SUN3_MOUSE Isoform of Q9ESD7, Dysferlin OS=Mus musculus OX=10090 GN=Dysf PE=1 SV=1;>tr|A0A0N4SVX9|A0A0N4SVX9_MOUSE Isoform of Q9ESD7, Dysferlin OS=Mus musculus OX=10090 GN=Dysf PE=1 SV=1;>tr|E9PXU9|E9PXU9_MOUSE Isoform of Q9ESD7, Dysferlin OS=Mus musculus OX=10090 GN=Dysf PE=1 SV=1	DYSF	19.616397416692	20.8365336702615	18.6604643187508	19.882887335685
Q9CXJ1	>sp|Q9CXJ1|SYEM_MOUSE Nondiscriminating glutamyl-tRNA synthetase EARS2, mitochondrial OS=Mus musculus OX=10090 GN=Ears2 PE=1 SV=1	EARS2	19.414630199077	19.2308661532632	18.6854651072608	
O35228	>sp|O35228|IL27B_MOUSE Interleukin-27 subunit beta OS=Mus musculus OX=10090 GN=Ebi3 PE=1 SV=1	EBI3		18.0996789596002	17.5237744341525	
Q9D903	>sp|Q9D903|EBP2_MOUSE Probable rRNA-processing protein EBP2 OS=Mus musculus OX=10090 GN=Ebna1bp2 PE=2 SV=1	EBNA1BP2	20.2506010020412	20.1839308714538	19.5510193513169	20.0259963117533
O35459	>sp|O35459|ECH1_MOUSE Delta(3,5)-Delta(2,4)-dienoyl-CoA isomerase, mitochondrial OS=Mus musculus OX=10090 GN=Ech1 PE=1 SV=1	ECH1	17.1846062776543	16.52571113471	17.7483270988265	17.2974030688137
Q3TLP5	>sp|Q3TLP5|ECHD2_MOUSE Enoyl-CoA hydratase domain-containing protein 2, mitochondrial OS=Mus musculus OX=10090 GN=Echdc2 PE=1 SV=2	ECHDC2	19.9216783430311	19.5844506837592		19.9012930374604
Q8BH95	>sp|Q8BH95|ECHM_MOUSE Enoyl-CoA hydratase, mitochondrial OS=Mus musculus OX=10090 GN=Echs1 PE=1 SV=1	ECHS1	18.6822621922406	19.2846351386916	19.4031301451594	18.5962460604754
P42125	>sp|P42125|ECI1_MOUSE Enoyl-CoA delta isomerase 1, mitochondrial OS=Mus musculus OX=10090 GN=Eci1 PE=1 SV=2	ECI1	19.9079044792666	19.4069157280568	20.0007193177715	20.2311727368127
E9PUY9;E9PVM6;E9PYA9;E9PYC6;E9Q7A8;E9Q858	>tr|E9PUY9|E9PUY9_MOUSE Isoform of Q9WUR2, Enoyl-Coenzyme A delta isomerase 2 (Fragment) OS=Mus musculus OX=10090 GN=Eci2 PE=1 SV=1;>tr|E9PVM6|E9PVM6_MOUSE Isoform of Q9WUR2, Enoyl-Coenzyme A delta isomerase 2 (Fragment) OS=Mus musculus OX=10090 GN=Eci2 PE=1 SV=1;>tr|E9PYA9|E9PYA9_MOUSE Isoform of Q9WUR2, Enoyl-Coenzyme A delta isomerase 2 (Fragment) OS=Mus musculus OX=10090 GN=Eci2 PE=1 SV=1;>tr|E9PYC6|E9PYC6_MOUSE Isoform of Q9WUR2, Enoyl-Coenzyme A delta isomerase 2 (Fragment) OS=Mus musculus OX=10090 GN=Eci2 PE=1 SV=1;>tr|E9Q7A8|E9Q7A8_MOUSE Isoform of Q9WUR2, Enoyl-Coenzyme A delta isomerase 2 (Fragment) OS=Mus musculus OX=10090 GN=Eci2 PE=1 SV=1;>tr|E9Q858|E9Q858_MOUSE Isoform of Q9WUR2, Enoyl-Coenzyme A delta isomerase 2 (Fragment) OS=Mus musculus OX=10090 GN=Eci2 PE=1 SV=1	ECI2	19.2563973092278	19.213388687656	19.8186921749857	19.8502940549507
Q9WUR2	>sp|Q9WUR2|ECI2_MOUSE Enoyl-CoA delta isomerase 2 OS=Mus musculus OX=10090 GN=Eci2 PE=1 SV=2	ECI2	18.7440475359232	18.8161149543207	16.9698822011057	18.617448700409
Q61508	>sp|Q61508|ECM1_MOUSE Extracellular matrix protein 1 OS=Mus musculus OX=10090 GN=Ecm1 PE=1 SV=2	ECM1	19.3893974257259	18.5077590167149	19.4826384692536	19.2801300334993
Q6PDI5	>sp|Q6PDI5|ECM29_MOUSE Proteasome adapter and scaffold protein ECM29 OS=Mus musculus OX=10090 GN=Ecpas PE=1 SV=4	ECPAS	17.3027092660343	18.1289011436199	17.5512432798523	17.6681883168608
Q8K2D3	>sp|Q8K2D3|EDC3_MOUSE Enhancer of mRNA-decapping protein 3 OS=Mus musculus OX=10090 GN=Edc3 PE=1 SV=1	EDC3	19.246954587566	18.2721199546132	19.8060802903994	19.3460508084953
G5E896	>tr|G5E896|G5E896_MOUSE Isoform of Q3UJB9, Enhancer of mRNA-decapping protein 4 OS=Mus musculus OX=10090 GN=Edc4 PE=1 SV=1	EDC4	19.6467445595105	19.1508153086048	19.8203843874321	19.3844158509524
Q9JMG1	>sp|Q9JMG1|EDF1_MOUSE Endothelial differentiation-related factor 1 OS=Mus musculus OX=10090 GN=Edf1 PE=1 SV=1	EDF1	19.9279826993937	19.6022600771815	19.9519643537592	19.708779250683
O35474	>sp|O35474|EDIL3_MOUSE EGF-like repeat and discoidin I-like domain-containing protein 3 OS=Mus musculus OX=10090 GN=Edil3 PE=1 SV=2	EDIL3	18.2247814159952	17.5342604546533	19.1684131813089	17.7964275417819
Q8BL66	>sp|Q8BL66|EEA1_MOUSE Early endosome antigen 1 OS=Mus musculus OX=10090 GN=Eea1 PE=1 SV=2	EEA1	18.219631461212	19.3036298983262	18.3662601591335	18.4755053463405
P10126	>sp|P10126|EF1A1_MOUSE Elongation factor 1-alpha 1 OS=Mus musculus OX=10090 GN=Eef1a1 PE=1 SV=3	EEF1A1	21.8854405667509	21.9137213998237	22.0022880828344	21.8061669835802
O70251	>sp|O70251|EF1B_MOUSE Elongation factor 1-beta OS=Mus musculus OX=10090 GN=Eef1b PE=1 SV=5	EEF1B	22.4396296729726	22.2097102585124	22.4347864167934	22.4726965455905
A0A0R4J1E2;Q80T06	>tr|A0A0R4J1E2|A0A0R4J1E2_MOUSE Isoform of P57776, Elongation factor 1-delta OS=Mus musculus OX=10090 GN=Eef1d PE=1 SV=1;>tr|Q80T06|Q80T06_MOUSE Isoform of P57776, Elongation factor 1-delta OS=Mus musculus OX=10090 GN=Eef1d PE=1 SV=1	EEF1D	21.327384990493	21.773605921621	21.2237923378378	21.6154198425916
A0A0R4J1L2;F6ZFU0	>tr|A0A0R4J1L2|A0A0R4J1L2_MOUSE Isoform of P57776, Elongation factor 1-delta OS=Mus musculus OX=10090 GN=Eef1d PE=1 SV=1;>tr|F6ZFU0|F6ZFU0_MOUSE Isoform of P57776, Elongation factor 1-delta (Fragment) OS=Mus musculus OX=10090 GN=Eef1d PE=1 SV=1	EEF1D	19.7180689898803	21.0084320298033	19.5475209392971	19.9073314351253
Q9D8N0	>sp|Q9D8N0|EF1G_MOUSE Elongation factor 1-gamma OS=Mus musculus OX=10090 GN=Eef1g PE=1 SV=3	EEF1G	20.2610013684924	20.2978874015903	20.5537302087089	20.5577914943364
P58252	>sp|P58252|EF2_MOUSE Elongation factor 2 OS=Mus musculus OX=10090 GN=Eef2 PE=1 SV=2	EEF2	20.2452447149535	20.8930945531236	20.464977443835	20.6789359411969
Q9JHW4	>sp|Q9JHW4|SELB_MOUSE Selenocysteine-specific elongation factor OS=Mus musculus OX=10090 GN=Eefsec PE=1 SV=2	EEFSEC		20.0832031183572	20.8307615213767	20.6092837171478
Q9WVJ9	>sp|Q9WVJ9|FBLN4_MOUSE EGF-containing fibulin-like extracellular matrix protein 2 OS=Mus musculus OX=10090 GN=Efemp2 PE=1 SV=1	EFEMP2		18.1569878777315		17.9622747788474
Q9D8Y0	>sp|Q9D8Y0|EFHD2_MOUSE EF-hand domain-containing protein D2 OS=Mus musculus OX=10090 GN=Efhd2 PE=1 SV=1	EFHD2	19.8499894081422	19.3003362449979	19.5182044520261	19.9338637797375
Q8C0D5	>sp|Q8C0D5|EFL1_MOUSE Elongation factor-like GTPase 1 OS=Mus musculus OX=10090 GN=Efl1 PE=1 SV=1	EFL1	19.9461656435734	20.1952044997585	19.8529303641921	20.2131823654521
P52795	>sp|P52795|EFNB1_MOUSE Ephrin-B1 OS=Mus musculus OX=10090 GN=Efnb1 PE=1 SV=1	EFNB1	18.5963437323372	18.2693156635576		18.2203930432611
Q01279	>sp|Q01279|EGFR_MOUSE Epidermal growth factor receptor OS=Mus musculus OX=10090 GN=Egfr PE=1 SV=1	EGFR	19.3145981399255	19.0036545509815	19.4682072861051	19.2327834767867
Q91YE3	>sp|Q91YE3|EGLN1_MOUSE Egl nine homolog 1 OS=Mus musculus OX=10090 GN=Egln1 PE=1 SV=2	EGLN1		16.7391283060272	17.4383435714169	
G5E8Y6	>tr|G5E8Y6|G5E8Y6_MOUSE Isoform of Q99MS7, EH domain binding protein 1-like 1 OS=Mus musculus OX=10090 GN=Ehbp1l1 PE=1 SV=1	EHBP1L1	23.288464908595	21.9665426923274	23.5568871843228	23.4455491759397
Q99MS7	>sp|Q99MS7|EH1L1_MOUSE EH domain-binding protein 1-like protein 1 OS=Mus musculus OX=10090 GN=Ehbp1l1 PE=1 SV=1	EHBP1L1	19.5124857270539	19.5918764755127	19.6814180358805	19.6237878304745
Q9WVK4	>sp|Q9WVK4|EHD1_MOUSE EH domain-containing protein 1 OS=Mus musculus OX=10090 GN=Ehd1 PE=1 SV=1	EHD1	19.5090792160639	19.8516893694678	19.3741147352837	19.3619065337124
Q8BH64	>sp|Q8BH64|EHD2_MOUSE EH domain-containing protein 2 OS=Mus musculus OX=10090 GN=Ehd2 PE=1 SV=1	EHD2	20.1447539010909	20.3484529831531	20.0255713051087	20.1897246080954
Q9EQP2	>sp|Q9EQP2|EHD4_MOUSE EH domain-containing protein 4 OS=Mus musculus OX=10090 GN=Ehd4 PE=1 SV=1	EHD4	20.4579543064775	20.7941363387848	20.4370078537407	20.5533270112385
Q5DW34	>sp|Q5DW34|EHMT1_MOUSE Histone-lysine N-methyltransferase EHMT1 OS=Mus musculus OX=10090 GN=Ehmt1 PE=1 SV=2	EHMT1	18.2153505391185	17.9738409976975	18.3501970259365	18.6691252700305
Q9Z148	>sp|Q9Z148|EHMT2_MOUSE Histone-lysine N-methyltransferase EHMT2 OS=Mus musculus OX=10090 GN=Ehmt2 PE=1 SV=2	EHMT2		17.8456871256865		18.7461495271619
P48024	>sp|P48024|EIF1_MOUSE Eukaryotic translation initiation factor 1 OS=Mus musculus OX=10090 GN=Eif1 PE=1 SV=2	EIF1	20.591088775069	18.525206937696	21.5527965791084	20.7453429335295
Q60872	>sp|Q60872|IF1A_MOUSE Eukaryotic translation initiation factor 1A OS=Mus musculus OX=10090 GN=Eif1a PE=2 SV=3	EIF1A	17.7424671128028	20.0855364865021	17.80535899658	19.3008692530261
Q3THJ3	>sp|Q3THJ3|EIF1A_MOUSE Probable RNA-binding protein EIF1AD OS=Mus musculus OX=10090 GN=Eif1ad PE=1 SV=2	EIF1AD	17.8880382430031	18.1730897643163	17.165054867087	18.1558120564981
Q8BMJ3	>sp|Q8BMJ3|IF1AX_MOUSE Eukaryotic translation initiation factor 1A, X-chromosomal OS=Mus musculus OX=10090 GN=Eif1ax PE=2 SV=3	EIF1AX	19.5042429874979	19.4783532877337	19.43005312428	19.2525472361354
Q8BJW6	>sp|Q8BJW6|EIF2A_MOUSE Eukaryotic translation initiation factor 2A OS=Mus musculus OX=10090 GN=Eif2a PE=1 SV=2	EIF2A	18.2180485534012	18.384429398999	18.3754083639314	18.0594704937436
Q99LD9	>sp|Q99LD9|EI2BB_MOUSE Translation initiation factor eIF2B subunit beta OS=Mus musculus OX=10090 GN=Eif2b2 PE=1 SV=1	EIF2B2	17.1245190754187	16.7867760397712	18.3379073200318	17.962988921596
B1AUN2	>tr|B1AUN2|B1AUN2_MOUSE Translation initiation factor eIF2B subunit gamma OS=Mus musculus OX=10090 GN=Eif2b3 PE=1 SV=1	EIF2B3	20.212830124705	18.2950362274188	19.8618656306278	19.7884921107506
A0A0J9YTQ7	>tr|A0A0J9YTQ7|A0A0J9YTQ7_MOUSE Isoform of Q61749, Eukaryotic translation initiation factor 2B, subunit 4 delta (Fragment) OS=Mus musculus OX=10090 GN=Eif2b4 PE=1 SV=1	EIF2B4	18.5154882593382		18.4920802156912	18.2832461016247
Q61749	>sp|Q61749|EI2BD_MOUSE Translation initiation factor eIF2B subunit delta OS=Mus musculus OX=10090 GN=Eif2b4 PE=1 SV=2	EIF2B4	17.5032365289699	16.4289613965889		17.0772975157994
Q6ZWX6	>sp|Q6ZWX6|IF2A_MOUSE Eukaryotic translation initiation factor 2 subunit 1 OS=Mus musculus OX=10090 GN=Eif2s1 PE=1 SV=3	EIF2S1	19.5069672192642	19.498162854768	19.8111673411246	19.5053357447124
Q99L45	>sp|Q99L45|IF2B_MOUSE Eukaryotic translation initiation factor 2 subunit 2 OS=Mus musculus OX=10090 GN=Eif2s2 PE=1 SV=1	EIF2S2	19.5539373373393	20.0873639387864	19.0441066291515	19.5628177615798
Q9Z0N1	>sp|Q9Z0N1|IF2G_MOUSE Eukaryotic translation initiation factor 2 subunit 3, X-linked OS=Mus musculus OX=10090 GN=Eif2s3x PE=1 SV=2	EIF2S3X	19.7426001877657	19.1413172389376	19.9627715200425	19.6140798375237
P23116	>sp|P23116|EIF3A_MOUSE Eukaryotic translation initiation factor 3 subunit A OS=Mus musculus OX=10090 GN=Eif3a PE=1 SV=5	EIF3A	20.6386791969771	20.1068365510123	20.8510916695811	20.4683674562004
Q8JZQ9	>sp|Q8JZQ9|EIF3B_MOUSE Eukaryotic translation initiation factor 3 subunit B OS=Mus musculus OX=10090 GN=Eif3b PE=1 SV=1	EIF3B	19.7398541292448	20.3591421274483	18.7741937571844	20.3092172232749
Q8R1B4	>sp|Q8R1B4|EIF3C_MOUSE Eukaryotic translation initiation factor 3 subunit C OS=Mus musculus OX=10090 GN=Eif3c PE=1 SV=1	EIF3C	19.1475560463796	19.4513983663494	19.5513184700489	19.2323544528005
O70194	>sp|O70194|EIF3D_MOUSE Eukaryotic translation initiation factor 3 subunit D OS=Mus musculus OX=10090 GN=Eif3d PE=1 SV=2	EIF3D	20.0474979974381	20.6171984279889	20.2300580522059	19.9305377116533
P60229	>sp|P60229|EIF3E_MOUSE Eukaryotic translation initiation factor 3 subunit E OS=Mus musculus OX=10090 GN=Eif3e PE=1 SV=1	EIF3E	19.4314668237452	19.5182351943958	19.6213320326621	19.6237038446851
Q9DCH4	>sp|Q9DCH4|EIF3F_MOUSE Eukaryotic translation initiation factor 3 subunit F OS=Mus musculus OX=10090 GN=Eif3f PE=1 SV=2	EIF3F	17.6251818417752	17.2796986266763	18.2186853565039	17.8992716153196
Q9Z1D1	>sp|Q9Z1D1|EIF3G_MOUSE Eukaryotic translation initiation factor 3 subunit G OS=Mus musculus OX=10090 GN=Eif3g PE=1 SV=2	EIF3G	19.6937399359462	19.5685741935003	20.1781397313255	20.0501989523282
Q9QZD9	>sp|Q9QZD9|EIF3I_MOUSE Eukaryotic translation initiation factor 3 subunit I OS=Mus musculus OX=10090 GN=Eif3i PE=1 SV=1	EIF3I	19.82817906668	19.9796068265001	20.2346769511628	20.400294550013
Q3UGC7;Q66JS6	>sp|Q3UGC7|EI3JA_MOUSE Eukaryotic translation initiation factor 3 subunit J-A OS=Mus musculus OX=10090 GN=Eif3j1 PE=2 SV=1;>sp|Q66JS6|EI3JB_MOUSE Eukaryotic translation initiation factor 3 subunit J-B OS=Mus musculus OX=10090 GN=Eif3j2 PE=1 SV=1	EIF3J1;EIF3J2	18.6840444703619	18.038549969655	19.2301554560171	18.6048548712924
Q9DBZ5	>sp|Q9DBZ5|EIF3K_MOUSE Eukaryotic translation initiation factor 3 subunit K OS=Mus musculus OX=10090 GN=Eif3k PE=1 SV=1	EIF3K	18.9481957622431	19.7038373994723	19.2328575643593	
Q99JX4	>sp|Q99JX4|EIF3M_MOUSE Eukaryotic translation initiation factor 3 subunit M OS=Mus musculus OX=10090 GN=Eif3m PE=1 SV=1	EIF3M	21.0564065847502	20.2540550581756	21.7493735441291	21.30464495658
P60843	>sp|P60843|IF4A1_MOUSE Eukaryotic initiation factor 4A-I OS=Mus musculus OX=10090 GN=Eif4a1 PE=1 SV=1	EIF4A1	19.9265682268774	20.1742386424046	20.0023798484702	20.1657079472226
Q91VC3	>sp|Q91VC3|IF4A3_MOUSE Eukaryotic initiation factor 4A-III OS=Mus musculus OX=10090 GN=Eif4a3 PE=1 SV=3	EIF4A3	21.0957596192573	20.9026054102068	20.6638404474901	21.2845376010288
Q8BGD9	>sp|Q8BGD9|IF4B_MOUSE Eukaryotic translation initiation factor 4B OS=Mus musculus OX=10090 GN=Eif4b PE=1 SV=1	EIF4B	20.8113223165076	20.3693336430413	20.8672978006662	20.3480303171526
P63073	>sp|P63073|IF4E_MOUSE Eukaryotic translation initiation factor 4E OS=Mus musculus OX=10090 GN=Eif4e PE=1 SV=1	EIF4E	18.8682950775998	19.4258420074217	18.7352620677029	18.5911831030265
Q8BMB3	>sp|Q8BMB3|IF4E2_MOUSE Eukaryotic translation initiation factor 4E type 2 OS=Mus musculus OX=10090 GN=Eif4e2 PE=1 SV=1	EIF4E2		17.1621553635837		17.2320413409442
Q60876	>sp|Q60876|4EBP1_MOUSE Eukaryotic translation initiation factor 4E-binding protein 1 OS=Mus musculus OX=10090 GN=Eif4ebp1 PE=1 SV=3	EIF4EBP1	19.0009419689606	17.7313823412235	20.0978280657032	18.5962406056713
Q9EST3	>sp|Q9EST3|4ET_MOUSE Eukaryotic translation initiation factor 4E transporter OS=Mus musculus OX=10090 GN=Eif4enif1 PE=1 SV=2	EIF4ENIF1	18.5099560858957	18.5740702687881	18.6269117747747	18.9143070367736
Q6NZJ6	>sp|Q6NZJ6|IF4G1_MOUSE Eukaryotic translation initiation factor 4 gamma 1 OS=Mus musculus OX=10090 GN=Eif4g1 PE=1 SV=1	EIF4G1	18.7461739214163	19.3969435075007	18.6184951749264	18.6166751376716
Q62448	>sp|Q62448|IF4G2_MOUSE Eukaryotic translation initiation factor 4 gamma 2 OS=Mus musculus OX=10090 GN=Eif4g2 PE=1 SV=2	EIF4G2	19.1673030125995	19.4459860169714	18.5889105158122	19.0335656314022
A0A0N4SVL0;A0AAA9WW03	>tr|A0A0N4SVL0|A0A0N4SVL0_MOUSE Isoform of Q80XI3, Eukaryotic translation initiation factor 4 gamma, 3 OS=Mus musculus OX=10090 GN=Eif4g3 PE=1 SV=2;>tr|A0AAA9WW03|A0AAA9WW03_MOUSE Isoform of Q80XI3, Eukaryotic translation initiation factor 4 gamma, 3 OS=Mus musculus OX=10090 GN=Eif4g3 PE=1 SV=1	EIF4G3	18.3333225327903	19.0247898591406	18.3100048429725	17.9765172104828
Q9WUK2	>sp|Q9WUK2|IF4H_MOUSE Eukaryotic translation initiation factor 4H OS=Mus musculus OX=10090 GN=Eif4h PE=1 SV=3	EIF4H	21.9760899841753	20.8025697944276	22.3886087745067	21.728847448188
P59325	>sp|P59325|IF5_MOUSE Eukaryotic translation initiation factor 5 OS=Mus musculus OX=10090 GN=Eif5 PE=1 SV=1	EIF5	19.9370792652833	20.1883182452647	19.4069210764178	19.8041368915064
