protein_id	fasta_headers	gene_symbols_or_id	MS1d4-L	MS2d4-L	MW1d4-L	MW2d4-L
E0CYV9	>sp|E0CYV9|CD054_MOUSE Uncharacterized protein C4orf54 homolog OS=Mus musculus OX=10090 PE=1 SV=1	sp|E0CYV9|CD054_MOUSE	17.6766135048557	17.0229201960674	18.2918742077376	18.0784480644862
Q3U6N9	>sp|Q3U6N9|CH033_MOUSE UPF0488 protein C8orf33 homolog OS=Mus musculus OX=10090 PE=2 SV=1	sp|Q3U6N9|CH033_MOUSE	20.5176995607355	20.2194652677665	20.7622695785765	20.8855427948918
Q5XFZ0	>sp|Q5XFZ0|CR021_MOUSE UPF0711 protein C18orf21 homolog OS=Mus musculus OX=10090 PE=2 SV=2	sp|Q5XFZ0|CR021_MOUSE	16.5707312694477	16.533163575271		16.9028975131242
Q8C3W1	>sp|Q8C3W1|CA198_MOUSE Uncharacterized protein C1orf198 homolog OS=Mus musculus OX=10090 PE=1 SV=1	sp|Q8C3W1|CA198_MOUSE	19.8571398200326	19.2086835434397	20.0969810022384	19.5479750922587
Q8WUR0	>sp|Q8WUR0|CS012_MOUSE Protein C19orf12 homolog OS=Mus musculus OX=10090 PE=1 SV=1	sp|Q8WUR0|CS012_MOUSE		18.9632808972492		18.6983751136199
Q91V76	>sp|Q91V76|CK054_MOUSE Ester hydrolase C11orf54 homolog OS=Mus musculus OX=10090 PE=1 SV=1	sp|Q91V76|CK054_MOUSE		18.5540290156911	17.7234911780768	18.7717825394081
Q9D727	>sp|Q9D727|CF226_MOUSE Uncharacterized protein C6orf226 homolog OS=Mus musculus OX=10090 PE=1 SV=1	sp|Q9D727|CF226_MOUSE	17.5381411524863	17.258214275422	18.2233531237992	17.7645689250383
Q9D7E4	>sp|Q9D7E4|CS025_MOUSE UPF0449 protein C19orf25 homolog OS=Mus musculus OX=10090 PE=1 SV=1	sp|Q9D7E4|CS025_MOUSE	18.6814349195088	17.7975590638363	18.9911841005782	18.1407898733149
A0AAQ4VMW9	>tr|A0AAQ4VMW9|A0AAQ4VMW9_MOUSE Uncharacterized protein OS=Mus musculus OX=10090 PE=4 SV=1	tr|A0AAQ4VMW9|A0AAQ4VMW9_MOUSE	18.7149705261343	18.0526153471892	18.5252429468058	18.3459676538214
D3YWR8	>tr|D3YWR8|D3YWR8_MOUSE Isoform of Q8K039, RIKEN cDNA 1110059G10 gene OS=Mus musculus OX=10090 GN=1110059G10Rik PE=1 SV=1	1110059G10RIK	19.6896695293107	18.9826263369165	19.3207460784993	
Q14AA6	>tr|Q14AA6|Q14AA6_MOUSE GTP-binding nuclear protein Ran OS=Mus musculus OX=10090 GN=1700009N14Rik PE=1 SV=1	1700009N14RIK	20.7407580103554	19.8028329656624	20.0495759247244	
Q8BWE1	>tr|Q8BWE1|Q8BWE1_MOUSE RIKEN cDNA 1810024B03 gene OS=Mus musculus OX=10090 GN=1810024B03Rik PE=2 SV=1	1810024B03RIK		18.581654026417	20.8415589363513	
Q6GQT1	>sp|Q6GQT1|A2MG_MOUSE Alpha-2-macroglobulin-P OS=Mus musculus OX=10090 GN=A2m PE=2 SV=2	A2M		18.2574902660533		18.545895069291
Q9D2R0	>sp|Q9D2R0|AACS_MOUSE Acetoacetyl-CoA synthetase OS=Mus musculus OX=10090 GN=Aacs PE=1 SV=1	AACS	19.1296329583405	19.5047306088762	18.7363331052384	19.0014423507591
Q8R2R3	>sp|Q8R2R3|AAGAB_MOUSE Alpha- and gamma-adaptin-binding protein p34 OS=Mus musculus OX=10090 GN=Aagab PE=1 SV=2	AAGAB		17.8713325392351		18.7238085512154
A0A571BEI2	>tr|A0A571BEI2|A0A571BEI2_MOUSE Isoform of Q3UHJ0, AP2 associated kinase 1 (Fragment) OS=Mus musculus OX=10090 GN=Aak1 PE=1 SV=1	AAK1	18.9786409411358	19.4468408262233	18.6614650234059	18.8558918771951
Q3UHJ0	>sp|Q3UHJ0|AAK1_MOUSE AP2-associated protein kinase 1 OS=Mus musculus OX=10090 GN=Aak1 PE=1 SV=2	AAK1	19.9196316343408	20.0478956346533	19.4140571744184	19.3619062785624
Q8R0P4	>sp|Q8R0P4|AAMDC_MOUSE Mth938 domain-containing protein OS=Mus musculus OX=10090 GN=Aamdc PE=1 SV=1	AAMDC	19.6416755263131	19.7870444230321	19.7447215942231	20.0047985544661
Q8BGQ7	>sp|Q8BGQ7|SYAC_MOUSE Alanine--tRNA ligase, cytoplasmic OS=Mus musculus OX=10090 GN=Aars1 PE=1 SV=1	AARS1	19.3555217825785	19.7266312342404	19.4746612826816	19.3928031606191
Q14CH7	>sp|Q14CH7|SYAM_MOUSE Alanine--tRNA ligase, mitochondrial OS=Mus musculus OX=10090 GN=Aars2 PE=1 SV=1	AARS2	19.3116350027474	18.2493906559345	19.9121735330503	19.662608183484
Q9JKX4	>sp|Q9JKX4|AATF_MOUSE Protein AATF OS=Mus musculus OX=10090 GN=Aatf PE=1 SV=1	AATF	19.0217142796423	18.1901614334426	19.461295017895	18.9874721441817
Q8K449	>sp|Q8K449|ABCA9_MOUSE ATP-binding cassette sub-family A member 9 OS=Mus musculus OX=10090 GN=Abca9 PE=1 SV=2	ABCA9	17.5464028708464	16.1488837029556	18.208949466023	17.5065034174453
Q9JI39	>sp|Q9JI39|ABCBA_MOUSE ATP-binding cassette sub-family B member 10, mitochondrial OS=Mus musculus OX=10090 GN=Abcb10 PE=1 SV=1	ABCB10	20.9018106482043	20.4609284979965	20.4457710985427	21.094732111478
Q9JJ59	>sp|Q9JJ59|ABCB9_MOUSE ABC-type oligopeptide transporter ABCB9 OS=Mus musculus OX=10090 GN=Abcb9 PE=1 SV=1	ABCB9	18.6676022166176	16.7962049496433	19.7756248087797	18.6848132387018
P61222	>sp|P61222|ABCE1_MOUSE ATP-binding cassette sub-family E member 1 OS=Mus musculus OX=10090 GN=Abce1 PE=1 SV=1	ABCE1	20.2319048538116	18.8113285534427	20.420968220538	20.024562892971
Q6P542	>sp|Q6P542|ABCF1_MOUSE ATP-binding cassette sub-family F member 1 OS=Mus musculus OX=10090 GN=Abcf1 PE=1 SV=1	ABCF1	19.8548640709124	20.146201986758	20.2653785524891	20.5044396201526
Q99LE6	>sp|Q99LE6|ABCF2_MOUSE ATP-binding cassette sub-family F member 2 OS=Mus musculus OX=10090 GN=Abcf2 PE=1 SV=1	ABCF2	19.3447764839045	19.969594448246	19.6725686095998	19.3262889520664
Q99LR1	>sp|Q99LR1|ABD12_MOUSE Lysophosphatidylserine lipase ABHD12 OS=Mus musculus OX=10090 GN=Abhd12 PE=1 SV=2	ABHD12		15.7444375102363		15.8588981460465
Q8VCR7	>sp|Q8VCR7|ABHEB_MOUSE Putative protein-lysine deacylase ABHD14B OS=Mus musculus OX=10090 GN=Abhd14b PE=1 SV=1	ABHD14B		16.6303249910873		17.9384725211893
Q9Z1Q2	>sp|Q9Z1Q2|ABHGA_MOUSE Phosphatidylserine lipase ABHD16A OS=Mus musculus OX=10090 GN=Abhd16a PE=1 SV=3	ABHD16A		17.29628401839		16.5209823301029
Q8VD66	>sp|Q8VD66|ABHD4_MOUSE (Lyso)-N-acylphosphatidylethanolamine lipase OS=Mus musculus OX=10090 GN=Abhd4 PE=1 SV=1	ABHD4	16.8314735530718	17.0746617721948		17.3419961826537
Q8CBW3	>sp|Q8CBW3|ABI1_MOUSE Abl interactor 1 OS=Mus musculus OX=10090 GN=Abi1 PE=1 SV=3	ABI1	22.5602792641687	22.0609699650432	22.4239465966654	22.2472002909205
P62484	>sp|P62484|ABI2_MOUSE Abl interactor 2 OS=Mus musculus OX=10090 GN=Abi2 PE=1 SV=1	ABI2	20.3892814553298	19.3802994572489	20.0903233503114	20.1530957039414
Q8K4G5	>sp|Q8K4G5|ABLM1_MOUSE Actin-binding LIM protein 1 OS=Mus musculus OX=10090 GN=Ablim1 PE=1 SV=1	ABLIM1	18.593247780322	18.9483100228936		18.6890817784443
A0A0J9YUE1	>tr|A0A0J9YUE1|A0A0J9YUE1_MOUSE Isoform of Q8BL65, Actin-binding LIM protein 2 OS=Mus musculus OX=10090 GN=Ablim2 PE=4 SV=1	ABLIM2	20.0680737241732	20.4192558361367	20.22759976371	
Q69ZX8	>sp|Q69ZX8|ABLM3_MOUSE Actin-binding LIM protein 3 OS=Mus musculus OX=10090 GN=Ablim3 PE=1 SV=2	ABLIM3	20.2317620404703	19.4806086877318	19.6331990814768	19.707739878628
Q8BUZ1	>sp|Q8BUZ1|ABRA_MOUSE Actin-binding Rho-activating protein OS=Mus musculus OX=10090 GN=Abra PE=1 SV=1	ABRA	17.8735423513111	18.0280424601571		17.5418739533727
Q4KML4	>sp|Q4KML4|ABRAL_MOUSE Costars family protein ABRACL OS=Mus musculus OX=10090 GN=Abracl PE=1 SV=1	ABRACL	21.0062375875191	21.1301783252224	20.3691778565488	19.861808017198
Q3TCJ1	>sp|Q3TCJ1|ABRX2_MOUSE BRISC complex subunit Abraxas 2 OS=Mus musculus OX=10090 GN=Abraxas2 PE=1 SV=1	ABRAXAS2	22.1093348481232	20.0926344541573	21.8474332331869	21.6468225949394
Q921H8	>sp|Q921H8|THIKA_MOUSE 3-ketoacyl-CoA thiolase A, peroxisomal OS=Mus musculus OX=10090 GN=Acaa1a PE=1 SV=1	ACAA1A	19.9284688079238	20.0361777872638	19.8009045866476	19.6054780846575
Q8BWT1	>sp|Q8BWT1|THIM_MOUSE 3-ketoacyl-CoA thiolase, mitochondrial OS=Mus musculus OX=10090 GN=Acaa2 PE=1 SV=3	ACAA2	20.1147326866886	20.4964524638587	19.7349344231049	20.4681075685626
Q5SWU9	>sp|Q5SWU9|ACACA_MOUSE Acetyl-CoA carboxylase 1 OS=Mus musculus OX=10090 GN=Acaca PE=1 SV=1	ACACA	17.8934629017407	17.1917492731238	17.6311686447022	17.8234213005975
Q9D7B6	>sp|Q9D7B6|ACAD8_MOUSE Isobutyryl-CoA dehydrogenase, mitochondrial OS=Mus musculus OX=10090 GN=Acad8 PE=1 SV=2	ACAD8	20.2658132519084	20.4084809347956	20.3719587254389	20.5830906740909
Q8JZN5	>sp|Q8JZN5|ACAD9_MOUSE Complex I assembly factor ACAD9, mitochondrial OS=Mus musculus OX=10090 GN=Acad9 PE=1 SV=2	ACAD9	19.5558706795616	19.6418858340788	19.8267877500114	20.348534687614
P51174	>sp|P51174|ACADL_MOUSE Long-chain specific acyl-CoA dehydrogenase, mitochondrial OS=Mus musculus OX=10090 GN=Acadl PE=1 SV=2	ACADL	20.4674117144144	20.6275100865114	20.4433752249452	20.6108687887719
P45952	>sp|P45952|ACADM_MOUSE Medium-chain specific acyl-CoA dehydrogenase, mitochondrial OS=Mus musculus OX=10090 GN=Acadm PE=1 SV=1	ACADM	18.9681015604306	19.5108866880258	19.4632602475662	19.5181271182804
Q07417	>sp|Q07417|ACADS_MOUSE Short-chain specific acyl-CoA dehydrogenase, mitochondrial OS=Mus musculus OX=10090 GN=Acads PE=1 SV=2	ACADS	19.6004476266037	19.9756763434285	20.1512397699615	20.0698871982111
Q9DBL1	>sp|Q9DBL1|ACDSB_MOUSE Short/branched chain specific acyl-CoA dehydrogenase, mitochondrial OS=Mus musculus OX=10090 GN=Acadsb PE=1 SV=1	ACADSB	19.2910163857332	19.0323945255524	19.3217712699705	19.090278560721
P50544	>sp|P50544|ACADV_MOUSE Very long-chain specific acyl-CoA dehydrogenase, mitochondrial OS=Mus musculus OX=10090 GN=Acadvl PE=1 SV=3	ACADVL	20.2428512099531	19.8279122564085	20.4780346305443	20.6214027199616
Q6ZQK5	>sp|Q6ZQK5|ACAP2_MOUSE Arf-GAP with coiled-coil, ANK repeat and PH domain-containing protein 2 OS=Mus musculus OX=10090 GN=Acap2 PE=1 SV=2	ACAP2		18.4635666478617		17.8531831314672
Q8QZT1	>sp|Q8QZT1|THIL_MOUSE Acetyl-CoA acetyltransferase, mitochondrial OS=Mus musculus OX=10090 GN=Acat1 PE=1 SV=1	ACAT1	20.9008323607336	20.6709005527371	20.9482312791369	20.9264737540217
Q8CAY6	>sp|Q8CAY6|THIC_MOUSE Acetyl-CoA acetyltransferase, cytosolic OS=Mus musculus OX=10090 GN=Acat2 PE=1 SV=2	ACAT2	19.6439833056792	18.890378856205	19.3826986612139	19.7529044378984
Q8BMP6	>sp|Q8BMP6|GCP60_MOUSE Golgi resident protein GCP60 OS=Mus musculus OX=10090 GN=Acbd3 PE=1 SV=3	ACBD3	20.0273497488204	18.2624541179899	20.1803782626097	20.0748212483588
Q5XG73	>sp|Q5XG73|ACBD5_MOUSE Acyl-CoA-binding domain-containing protein 5 OS=Mus musculus OX=10090 GN=Acbd5 PE=1 SV=1	ACBD5	16.3060483701203	17.2605661156095	15.909392336299	
Q9JIX8	>sp|Q9JIX8|ACINU_MOUSE Apoptotic chromatin condensation inducer in the nucleus OS=Mus musculus OX=10090 GN=Acin1 PE=1 SV=3	ACIN1	18.4819110457958	18.6306533001576	18.276792153683	18.1276776126252
Q3V117	>tr|Q3V117|Q3V117_MOUSE Isoform of Q91V92, ATP-citrate synthase OS=Mus musculus OX=10090 GN=Acly PE=1 SV=1	ACLY	20.0194971591822	20.0513055039037	19.5086566746888	20.0629731777417
Q99KI0	>sp|Q99KI0|ACON_MOUSE Aconitate hydratase, mitochondrial OS=Mus musculus OX=10090 GN=Aco2 PE=1 SV=1	ACO2	20.5488383810295	21.0539540946813	20.7500911743421	21.0218820043487
Q9QYR9	>sp|Q9QYR9|ACOT2_MOUSE Acyl-coenzyme A thioesterase 2, mitochondrial OS=Mus musculus OX=10090 GN=Acot2 PE=1 SV=2	ACOT2	20.5531606869696	21.7681595040363	20.5765148931387	20.938763571925
Q91V12	>sp|Q91V12|BACH_MOUSE Cytosolic acyl coenzyme A thioester hydrolase OS=Mus musculus OX=10090 GN=Acot7 PE=1 SV=2	ACOT7	19.2358541413426	18.7665471670101	19.5025325119363	19.0652585434747
Q9R0X4	>sp|Q9R0X4|ACOT9_MOUSE Acyl-coenzyme A thioesterase 9, mitochondrial OS=Mus musculus OX=10090 GN=Acot9 PE=1 SV=1	ACOT9	19.2916411639579	19.4932510893169	20.3554455570043	19.9853003281568
Q9D358	>sp|Q9D358|PPAC_MOUSE Low molecular weight phosphotyrosine protein phosphatase OS=Mus musculus OX=10090 GN=Acp1 PE=1 SV=3	ACP1	21.4725622756213	22.1219473023075	21.8382152202566	21.8099754543779
P24638	>sp|P24638|PPAL_MOUSE Lysosomal acid phosphatase OS=Mus musculus OX=10090 GN=Acp2 PE=1 SV=2	ACP2	19.8896392427333	19.422749784292	20.2387663951885	20.0076405357245
Q8BP40	>sp|Q8BP40|PPA6_MOUSE Lysophosphatidic acid phosphatase type 6 OS=Mus musculus OX=10090 GN=Acp6 PE=1 SV=1	ACP6	20.3763014455361	19.4595268160728	20.751926028734	20.3597298386323
Q3V140	>sp|Q3V140|ACRBP_MOUSE Acrosin-binding protein OS=Mus musculus OX=10090 GN=Acrbp PE=1 SV=1	ACRBP	19.9030674130634	20.2545605718388	19.8989605538397	19.9809643726867
Q9CZW4	>sp|Q9CZW4|ACSL3_MOUSE Fatty acid CoA ligase Acsl3 OS=Mus musculus OX=10090 GN=Acsl3 PE=1 SV=2	ACSL3	18.1076826784711	18.972349710933	18.1254364766841	17.8474044280653
Q9QXG4	>sp|Q9QXG4|ACSA_MOUSE Acetyl-coenzyme A synthetase, cytoplasmic OS=Mus musculus OX=10090 GN=Acss2 PE=1 SV=2	ACSS2	19.428869367338			18.5623732184387
P68134	>sp|P68134|ACTS_MOUSE Actin, alpha skeletal muscle OS=Mus musculus OX=10090 GN=Acta1 PE=1 SV=1	ACTA1	22.4358451685452	22.5553544210685	22.4691857393399	22.2541899397006
Q8BFZ3	>sp|Q8BFZ3|ACTBL_MOUSE Beta-actin-like protein 2 OS=Mus musculus OX=10090 GN=Actbl2 PE=1 SV=1	ACTBL2	22.412858474817	22.819774563883	22.4288438268265	21.9289162671321
P63260	>sp|P63260|ACTG_MOUSE Actin, cytoplasmic 2 OS=Mus musculus OX=10090 GN=Actg1 PE=1 SV=1	ACTG1	20.7823219503354	20.7537528436669	21.171499654684	20.3896443175687
P63268	>sp|P63268|ACTH_MOUSE Actin, gamma-enteric smooth muscle OS=Mus musculus OX=10090 GN=Actg2 PE=1 SV=1	ACTG2	20.7323822844523	20.6793337365779	20.287869190036	20.8854838131843
Q9Z2N8	>sp|Q9Z2N8|ACL6A_MOUSE Actin-like protein 6A OS=Mus musculus OX=10090 GN=Actl6a PE=1 SV=2	ACTL6A	18.9609607193666	18.8245157725316		19.1554323756588
Q7TPR4	>sp|Q7TPR4|ACTN1_MOUSE Alpha-actinin-1 OS=Mus musculus OX=10090 GN=Actn1 PE=1 SV=1	ACTN1	19.3130435990828	19.5036341049057	19.3483641880501	19.1007596314854
Q9JI91	>sp|Q9JI91|ACTN2_MOUSE Alpha-actinin-2 OS=Mus musculus OX=10090 GN=Actn2 PE=1 SV=2	ACTN2	18.5724773759704	19.5429699716537	18.3599485024731	18.7932116608239
O88990	>sp|O88990|ACTN3_MOUSE Alpha-actinin-3 OS=Mus musculus OX=10090 GN=Actn3 PE=1 SV=1	ACTN3	18.6598952362273	19.4782766291402	18.4647058574165	19.5624228553484
P57780	>sp|P57780|ACTN4_MOUSE Alpha-actinin-4 OS=Mus musculus OX=10090 GN=Actn4 PE=1 SV=1	ACTN4	19.8909249781708	20.4767420634712	20.0338674331567	20.0329921895262
Q9QZB7	>sp|Q9QZB7|ARP10_MOUSE Actin-related protein 10 OS=Mus musculus OX=10090 GN=Actr10 PE=1 SV=2	ACTR10	19.9400197227874	19.2430765612871	20.3698377522144	20.0114506340193
P61164	>sp|P61164|ACTZ_MOUSE Alpha-centractin OS=Mus musculus OX=10090 GN=Actr1a PE=1 SV=1	ACTR1A	20.0908730336084	21.0453713031561	20.4317943148527	20.1462937131682
P61161	>sp|P61161|ARP2_MOUSE Actin-related protein 2 OS=Mus musculus OX=10090 GN=Actr2 PE=1 SV=1	ACTR2	19.1742345731893	19.5772032668299	19.3567102067578	20.1168193665165
Q99JY9	>sp|Q99JY9|ARP3_MOUSE Actin-related protein 3 OS=Mus musculus OX=10090 GN=Actr3 PE=1 SV=3	ACTR3	20.0274712127887	20.2301143855112	20.2346423349718	20.72095057347
Q80US4	>sp|Q80US4|ARP5_MOUSE Actin-related protein 5 OS=Mus musculus OX=10090 GN=Actr5 PE=1 SV=3	ACTR5	15.6666434427186	15.1961280664572	14.7042877689078	15.3619939850369
P56376	>sp|P56376|ACYP1_MOUSE Acylphosphatase-1 OS=Mus musculus OX=10090 GN=Acyp1 PE=1 SV=2	ACYP1	20.1656379614687	21.2280855610666		20.347092308061
P56375	>sp|P56375|ACYP2_MOUSE Acylphosphatase-2 OS=Mus musculus OX=10090 GN=Acyp2 PE=1 SV=2	ACYP2	20.9239247989071	20.2095667727479	20.4635742616857	20.7186685894055
D3YUK3;D3Z117	>tr|D3YUK3|D3YUK3_MOUSE Isoform of Q61824, ADAM metallopeptidase domain 12 (Fragment) OS=Mus musculus OX=10090 GN=Adam12 PE=1 SV=1;>tr|D3Z117|D3Z117_MOUSE Isoform of Q61824, ADAM metallopeptidase domain 12 (Fragment) OS=Mus musculus OX=10090 GN=Adam12 PE=1 SV=1	ADAM12	19.3112201870515	18.037477179269	19.9291893667319	19.7941389587164
Q9R1V7	>sp|Q9R1V7|ADA23_MOUSE Disintegrin and metalloproteinase domain-containing protein 23 OS=Mus musculus OX=10090 GN=Adam23 PE=1 SV=1	ADAM23	19.1521943627653	19.1081759393793		19.4830871602973
Q8BNJ2	>sp|Q8BNJ2|ATS4_MOUSE A disintegrin and metalloproteinase with thrombospondin motifs 4 OS=Mus musculus OX=10090 GN=Adamts4 PE=2 SV=2	ADAMTS4	22.5031572888559	20.7320489036563	22.3785365987916	22.715575294617
Q6PAT0	>sp|Q6PAT0|ADAT3_MOUSE Probable inactive tRNA-specific adenosine deaminase-like protein 3 OS=Mus musculus OX=10090 GN=Adat3 PE=1 SV=1	ADAT3	19.941917753703	18.9510289638355	19.6494551993292	
Q9QYC0	>sp|Q9QYC0|ADDA_MOUSE Alpha-adducin OS=Mus musculus OX=10090 GN=Add1 PE=1 SV=2	ADD1	21.1186261145388	20.6570900382132	21.0134883068799	20.792280766654
P00329	>sp|P00329|ADH1_MOUSE Alcohol dehydrogenase 1 OS=Mus musculus OX=10090 GN=Adh1 PE=1 SV=2	ADH1		18.7315755574513	18.7757216372072	19.0252802513076
P28474	>sp|P28474|ADHX_MOUSE Alcohol dehydrogenase class-3 OS=Mus musculus OX=10090 GN=Adh5 PE=1 SV=3	ADH5	18.6215324056984	19.0873395343193	18.7186595471491	18.8998462475528
Q99JT9	>sp|Q99JT9|MTND_MOUSE Acireductone dioxygenase OS=Mus musculus OX=10090 GN=Adi1 PE=1 SV=1	ADI1	19.1825367222036	19.6046321615026		19.6919782814041
P55264	>sp|P55264|ADK_MOUSE Adenosine kinase OS=Mus musculus OX=10090 GN=Adk PE=1 SV=2	ADK	18.9035743952417	18.5373098222143	18.4616405601651	18.8150119809702
Q9Z103	>sp|Q9Z103|ADNP_MOUSE Activity-dependent neuroprotector homeobox protein OS=Mus musculus OX=10090 GN=Adnp PE=1 SV=2	ADNP	18.7459709752747	18.9132230509398	18.6917061386101	18.4333907951437
Q6PDY2	>sp|Q6PDY2|AEDO_MOUSE 2-aminoethanethiol dioxygenase OS=Mus musculus OX=10090 GN=Ado PE=1 SV=2	ADO	19.2982041092012	19.562199032457	19.4076797021744	19.548932075697
P54923	>sp|P54923|ADPRH_MOUSE ADP-ribosylhydrolase ARH1 OS=Mus musculus OX=10090 GN=Adprh PE=1 SV=1	ADPRH	22.8262471370009	21.8796550420602	22.7231107654701	22.5380701596028
Q8CG72	>sp|Q8CG72|ADPRS_MOUSE ADP-ribosylhydrolase ARH3 OS=Mus musculus OX=10090 GN=Adprs PE=1 SV=1	ADPRS	19.9181298519595	19.1769120351739	19.6817377748772	19.7852055039711
Q9JKV1	>sp|Q9JKV1|ADRM1_MOUSE Proteasomal ubiquitin receptor ADRM1 OS=Mus musculus OX=10090 GN=Adrm1 PE=1 SV=2	ADRM1	18.2234565663237	18.6729245008109	18.3242107263224	17.8254724195673
P54822	>sp|P54822|PUR8_MOUSE Adenylosuccinate lyase OS=Mus musculus OX=10090 GN=Adsl PE=1 SV=2	ADSL	18.6525820391671	18.9790955813318	18.8744504170395	18.7299968622631
P28650	>sp|P28650|PURA1_MOUSE Adenylosuccinate synthetase isozyme 1 OS=Mus musculus OX=10090 GN=Adss1 PE=1 SV=2	ADSS1		17.3384278723644		16.704201584003
P46664	>sp|P46664|PURA2_MOUSE Adenylosuccinate synthetase isozyme 2 OS=Mus musculus OX=10090 GN=Adss2 PE=1 SV=2	ADSS2	19.9879043748051	18.9971178315851	20.4398188518735	20.1093639828271
Q9QZQ1	>sp|Q9QZQ1|AFAD_MOUSE Afadin OS=Mus musculus OX=10090 GN=Afdn PE=1 SV=3	AFDN	19.3144186173819	18.7563833289739	19.1576911938494	19.3163218119209
Q8JZQ2	>sp|Q8JZQ2|AFG32_MOUSE Mitochondrial inner membrane m-AAA protease component AFG3L2 OS=Mus musculus OX=10090 GN=Afg3l2 PE=1 SV=1	AFG3L2	19.2725288685319	18.4302703352934	19.9103976715792	18.1332492273874
Q64191	>sp|Q64191|ASPG_MOUSE N(4)-(beta-N-acetylglucosaminyl)-L-asparaginase OS=Mus musculus OX=10090 GN=Aga PE=1 SV=1	AGA	20.1021320397957	20.2539574457888	19.8959828683752	19.8346495430146
Q8K2K6	>sp|Q8K2K6|AGFG1_MOUSE Arf-GAP domain and FG repeat-containing protein 1 OS=Mus musculus OX=10090 GN=Agfg1 PE=1 SV=2	AGFG1	15.9128059414219	15.5527775406699	15.7754449674492	
Q80WC7	>sp|Q80WC7|AGFG2_MOUSE Arf-GAP domain and FG repeat-containing protein 2 OS=Mus musculus OX=10090 GN=Agfg2 PE=1 SV=1	AGFG2		18.2790615938804		18.9834126352039
F8VPN4	>tr|F8VPN4|F8VPN4_MOUSE Glycogen debranching enzyme OS=Mus musculus OX=10090 GN=Agl PE=1 SV=1	AGL	20.1581226369512	19.5493842224664	19.2030984554511	20.5700092368231
Q8CJG0	>sp|Q8CJG0|AGO2_MOUSE Protein argonaute-2 OS=Mus musculus OX=10090 GN=Ago2 PE=1 SV=3	AGO2	20.1267473082855	18.9379108970332	20.4186850377431	19.7858502708165
Q8K4X7	>sp|Q8K4X7|PLCD_MOUSE 1-acyl-sn-glycerol-3-phosphate acyltransferase delta OS=Mus musculus OX=10090 GN=Agpat4 PE=1 SV=1	AGPAT4	17.8868509839646	18.1379333687076	16.8464824098124	
A2ASQ1	>sp|A2ASQ1|AGRIN_MOUSE Agrin OS=Mus musculus OX=10090 GN=Agrn PE=1 SV=1	AGRN	18.338246647657	15.5764488191736	18.2799010390443	17.8553789089904
Q8CJF7	>sp|Q8CJF7|ELYS_MOUSE Protein ELYS OS=Mus musculus OX=10090 GN=Ahctf1 PE=1 SV=1	AHCTF1	20.571079190361	19.658772256015	21.0007989511422	21.0322459888927
P50247	>sp|P50247|SAHH_MOUSE Adenosylhomocysteinase OS=Mus musculus OX=10090 GN=Ahcy PE=1 SV=3	AHCY	21.3833401896307	20.9391189034467	20.775003411045	21.4033006640089
Q6PAL7	>sp|Q6PAL7|AHDC1_MOUSE Transcription factor Gibbin OS=Mus musculus OX=10090 GN=Ahdc1 PE=1 SV=1	AHDC1	18.8373229426586	18.5739087427071	18.4124574112713	18.7238237638742
E9Q616	>tr|E9Q616|E9Q616_MOUSE AHNAK nucleoprotein OS=Mus musculus OX=10090 GN=Ahnak PE=1 SV=1	AHNAK	20.8553083137348	21.2778693156617	20.5877569514306	20.626547900683
A0A7N9VR94	>tr|A0A7N9VR94|A0A7N9VR94_MOUSE AHNAK nucleoprotein 2 OS=Mus musculus OX=10090 GN=Ahnak2 PE=1 SV=1	AHNAK2	20.3289192577693	19.7087704354357	20.2802509490313	20.1850450229376
Q8BK64	>sp|Q8BK64|AHSA1_MOUSE Activator of 90 kDa heat shock protein ATPase homolog 1 OS=Mus musculus OX=10090 GN=Ahsa1 PE=1 SV=2	AHSA1	18.893522316836	18.9681358763233	19.0459783349965	18.9702939365656
Q8C4Q6	>sp|Q8C4Q6|AIDA_MOUSE Axin interactor, dorsalization-associated protein OS=Mus musculus OX=10090 GN=Aida PE=1 SV=1	AIDA	17.842854342588		17.4866821642664	17.8749554205223
Q9Z0X1	>sp|Q9Z0X1|AIFM1_MOUSE Apoptosis-inducing factor 1, mitochondrial OS=Mus musculus OX=10090 GN=Aifm1 PE=1 SV=1	AIFM1	20.1726433253171	20.7635015889966	20.3282446831959	20.6901377987215
P31230	>sp|P31230|AIMP1_MOUSE Aminoacyl tRNA synthase complex-interacting multifunctional protein 1 OS=Mus musculus OX=10090 GN=Aimp1 PE=1 SV=2	AIMP1	21.1818584035095	20.5750334059965	21.3222228580599	21.0662587150312
Q8R010	>sp|Q8R010|AIMP2_MOUSE Aminoacyl tRNA synthase complex-interacting multifunctional protein 2 OS=Mus musculus OX=10090 GN=Aimp2 PE=1 SV=2	AIMP2	19.0972273311628	18.616611588666	19.6529143769864	18.9726218679925
O08915	>sp|O08915|AIP_MOUSE AH receptor-interacting protein OS=Mus musculus OX=10090 GN=Aip PE=1 SV=1	AIP	19.4018651813515	19.7536329256574	19.5800103822801	19.6493353624023
Q91XC0	>sp|Q91XC0|AJUBA_MOUSE LIM domain-containing protein ajuba OS=Mus musculus OX=10090 GN=Ajuba PE=1 SV=1	AJUBA	16.5571249301985	15.7028413347	17.245896350422	17.2740892438633
Q9R0Y5	>sp|Q9R0Y5|KAD1_MOUSE Adenylate kinase isoenzyme 1 OS=Mus musculus OX=10090 GN=Ak1 PE=1 SV=1	AK1	21.165669737991	21.515006783548	21.1894933782257	21.2622270528235
F7BP55	>tr|F7BP55|F7BP55_MOUSE Isoform of Q9WTP6, Adenylate kinase 2 (Fragment) OS=Mus musculus OX=10090 GN=Ak2 PE=1 SV=1	AK2	18.2860234211119		19.965476010334	19.3819561691686
Q9WTP6	>sp|Q9WTP6|KAD2_MOUSE Adenylate kinase 2, mitochondrial OS=Mus musculus OX=10090 GN=Ak2 PE=1 SV=5	AK2	19.8277783834041	20.4168457124213	19.7472022554919	20.1012714641128
Q9WTP7	>sp|Q9WTP7|KAD3_MOUSE GTP:AMP phosphotransferase AK3, mitochondrial OS=Mus musculus OX=10090 GN=Ak3 PE=1 SV=3	AK3	20.0491655926498	19.0763565863363	19.8674062089413	19.7861785983566
Q9WUR9	>sp|Q9WUR9|KAD4_MOUSE Adenylate kinase 4, mitochondrial OS=Mus musculus OX=10090 GN=Ak4 PE=1 SV=1	AK4	19.9936555107603	19.97966258678	19.3722322267583	20.2301211081838
Q8VCP8	>sp|Q8VCP8|KAD6_MOUSE Adenylate kinase isoenzyme 6 OS=Mus musculus OX=10090 GN=Ak6 PE=1 SV=1	AK6	21.5598057927916	19.5373780875611	21.7411309660746	21.482955336729
O08715	>sp|O08715|AKAP1_MOUSE A-kinase anchor protein 1, mitochondrial OS=Mus musculus OX=10090 GN=Akap1 PE=1 SV=4	AKAP1	19.5588697689601	19.3788328648655	20.215192384385	19.8418146023192
E9Q777	>tr|E9Q777|E9Q777_MOUSE A kinase anchor protein 11 OS=Mus musculus OX=10090 GN=Akap11 PE=1 SV=2	AKAP11	17.1763937408312	17.0561576541374	17.3012227376025	16.861344785326
Q9WTQ5	>sp|Q9WTQ5|AKA12_MOUSE A-kinase anchor protein 12 OS=Mus musculus OX=10090 GN=Akap12 PE=1 SV=1	AKAP12	19.9033826673192	19.5889604491853	19.838373939905	19.6462348256598
E9Q394	>sp|E9Q394|AKP13_MOUSE A-kinase anchor protein 13 OS=Mus musculus OX=10090 GN=Akap13 PE=1 SV=1	AKAP13	18.4714806884105	18.1425757580404	17.7258450826442	17.9650328009082
E9Q9K8	>tr|E9Q9K8|E9Q9K8_MOUSE A kinase anchor protein 6 OS=Mus musculus OX=10090 GN=Akap6 PE=1 SV=1	AKAP6		18.4020611246936	18.9321089454508	19.4896928499326
Q9DBR0	>sp|Q9DBR0|AKAP8_MOUSE A-kinase anchor protein 8 OS=Mus musculus OX=10090 GN=Akap8 PE=1 SV=1	AKAP8	17.3659086096939	17.8963606314209	17.0748669784659	17.427008122648
Q9R0L7	>sp|Q9R0L7|AKP8L_MOUSE A-kinase anchor protein 8-like OS=Mus musculus OX=10090 GN=Akap8l PE=1 SV=1	AKAP8L	17.5288304038061	16.3496329153792		18.0810172109814
Q9JII6	>sp|Q9JII6|AK1A1_MOUSE Aldo-keto reductase family 1 member A1 OS=Mus musculus OX=10090 GN=Akr1a1 PE=1 SV=3	AKR1A1	20.1882132549398	20.6182603316269	20.0627846130317	20.407955323802
P45376	>sp|P45376|ALDR_MOUSE Aldo-keto reductase family 1 member B1 OS=Mus musculus OX=10090 GN=Akr1b1 PE=1 SV=3	AKR1B1	20.7105545538856	20.5222599678819	21.3378599351278	21.6101258397018
P45377	>sp|P45377|ALD2_MOUSE Aldose reductase-related protein 2 OS=Mus musculus OX=10090 GN=Akr1b8 PE=1 SV=2	AKR1B8	19.6560626294036	19.4230795912137	20.0241561759045	19.6277631750535
Q8CG76	>sp|Q8CG76|ARK72_MOUSE Aflatoxin B1 aldehyde reductase member 2 OS=Mus musculus OX=10090 GN=Akr7a2 PE=1 SV=3	AKR7A2	18.2769908737247	17.9446513561794	18.2069569061886	18.2374066800759
Q9D1F4	>sp|Q9D1F4|AKTS1_MOUSE Proline-rich AKT1 substrate 1 OS=Mus musculus OX=10090 GN=Akt1s1 PE=1 SV=1	AKT1S1	21.2819058362659	20.5582444387868	21.3846805613747	21.3850591403077
Q60823	>sp|Q60823|AKT2_MOUSE RAC-beta serine/threonine-protein kinase OS=Mus musculus OX=10090 GN=Akt2 PE=1 SV=1	AKT2	19.4546354986959	18.6416181235432	19.6894589287494	19.9765959464301
P10518	>sp|P10518|HEM2_MOUSE Delta-aminolevulinic acid dehydratase OS=Mus musculus OX=10090 GN=Alad PE=1 SV=1	ALAD	19.9450826217719	19.319783392276	20.1781047710172	20.1819857261288
P07724	>sp|P07724|ALBU_MOUSE Albumin OS=Mus musculus OX=10090 GN=Alb PE=1 SV=3	ALB	21.8532757281247	23.1410498921833	22.7230026638151	24.3284883948693
Q571I9	>sp|Q571I9|A16A1_MOUSE Aldehyde dehydrogenase family 16 member A1 OS=Mus musculus OX=10090 GN=Aldh16a1 PE=1 SV=2	ALDH16A1	20.182104166842	18.1373682407412	21.0658836083904	19.9788012851169
Q9Z110	>sp|Q9Z110|P5CS_MOUSE Delta-1-pyrroline-5-carboxylate synthase OS=Mus musculus OX=10090 GN=Aldh18a1 PE=1 SV=2	ALDH18A1	19.6931918663716	19.5030354580005	19.8757403505827	19.4073679370562
